Search.setIndex({"alltitles":{"\"Likes\"":[[28,"likes"]],"A partir PyPI ou des sources":[[44,"from-pypi-or-sources"]],"A partir de PyPI":[[41,"from-pypi"],[44,"from-pypi"]],"A partir des sources":[[41,"from-sources"],[44,"from-sources"]],"A propos":[[23,"about"]],"Administrateur":[[47,null]],"Administration":[[23,null]],"Affichage":[[33,"display"]],"Ajout manuel":[[33,"manual-addition"]],"Altitude":[[33,"elevation"]],"Application":[[23,"application"]],"Authentification et compte":[[0,null]],"Autres sports":[[33,"other-sports"]],"Avec Docker":[[44,"with-docker"]],"Base de donn\u00e9es":[[20,"database"]],"Bugs corrig\u00e9s":[[19,"bugs-fixed"],[19,"id2"],[19,"id3"],[19,"id7"],[19,"id10"],[19,"id12"],[19,"id15"],[19,"id19"],[19,"id23"],[19,"id29"],[19,"id34"],[19,"id37"],[19,"id39"],[19,"id42"],[19,"id47"],[19,"id49"],[19,"id52"],[19,"id54"],[19,"id58"],[19,"id60"],[19,"id62"],[19,"id68"],[19,"id72"],[19,"id75"],[19,"id81"],[19,"id85"],[19,"id89"],[19,"id91"],[19,"id96"],[19,"id99"],[19,"id101"],[19,"id103"],[19,"id111"],[19,"id114"],[19,"id117"],[19,"id122"],[19,"id128"],[19,"id133"],[19,"id137"],[19,"id140"],[19,"id142"],[19,"id146"],[19,"id150"],[19,"id154"],[19,"id157"],[19,"id160"],[19,"id163"],[19,"id164"],[19,"id167"],[19,"id169"],[19,"id171"],[19,"id174"],[19,"id177"],[19,"id185"],[19,"id188"],[19,"id191"],[19,"id194"],[19,"id206"],[19,"id211"],[19,"id213"],[19,"id217"],[19,"id220"],[19,"id223"],[19,"id225"],[19,"id228"],[19,"id231"],[19,"id233"],[19,"id236"],[19,"id239"],[19,"id242"],[19,"id247"],[19,"id249"],[19,"id251"],[19,"id253"],[19,"id256"],[19,"id258"],[19,"id264"],[19,"id267"],[19,"id269"],[19,"id271"],[19,"id278"],[19,"id283"],[19,"id285"],[19,"id287"],[19,"id290"],[19,"id292"],[19,"id294"],[19,"id298"],[19,"id308"],[19,"id311"],[19,"id313"],[19,"id316"],[19,"id323"]],"Carte":[[33,"map"]],"Carte Globale":[[26,null]],"Chargement d'archives":[[22,"archive-uploads"]],"Chargement de fichier":[[33,"file-upload"]],"Comment installer FitTrackee":[[21,"how-to-install-fittrackee"]],"Commentaires":[[1,null],[28,"comments"]],"Compte":[[22,"account"]],"Compte et pr\u00e9f\u00e9rences":[[22,null]],"Configuration":[[2,null],[23,"configuration"]],"Configuration des sports":[[33,"sports-configuration"]],"Conteneur de D\u00e9veloppement":[[41,"dev-container"]],"Contribuer":[[21,null]],"Contribuer au code":[[21,"contributing-code"]],"Courriels":[[38,null]],"Cr\u00e9ation":[[33,"creation"]],"Demandes de suivi":[[5,null],[22,"follow-requests"],[28,"follow-requests"]],"Des s\u00e9ances cr\u00e9\u00e9es \u00e0 partir de fichiers ne sont pas affich\u00e9es sur la carte":[[47,"workouts-created-with-a-file-are-not-displayed-on-the-workouts-map"]],"Divers":[[19,"misc"],[19,"id5"],[19,"id9"],[19,"id14"],[19,"id17"],[19,"id21"],[19,"id24"],[19,"id26"],[19,"id28"],[19,"id36"],[19,"id44"],[19,"id67"],[19,"id70"],[19,"id77"],[19,"id79"],[19,"id83"],[19,"id87"],[19,"id92"],[19,"id94"],[19,"id100"],[19,"id104"],[19,"id106"],[19,"id109"],[19,"id113"],[19,"id120"],[19,"id124"],[19,"id127"],[19,"id131"],[19,"id135"],[19,"id139"],[19,"id144"],[19,"id148"],[19,"id152"],[19,"id159"],[19,"id162"],[19,"id166"],[19,"id168"],[19,"id172"],[19,"id179"],[19,"id182"],[19,"id190"],[19,"id197"],[19,"id208"],[19,"id210"],[19,"id226"],[19,"id240"],[19,"id243"],[19,"id260"],[19,"id262"],[19,"id279"],[19,"id288"],[19,"id295"],[19,"id299"],[19,"id306"],[19,"id317"],[19,"id320"]],"Docker":[[41,"docker"]],"Docker Compose":[[39,"docker-compose"]],"Documentation":[[19,"documentation"],[19,"id181"],[19,"id215"]],"Documentation de l'API":[[7,null]],"Donn\u00e9es affich\u00e9es":[[33,"displayed-data"]],"Donn\u00e9es calcul\u00e9es":[[33,"calculated-data"]],"Donn\u00e9es m\u00e9t\u00e9o":[[45,null]],"Donn\u00e9es saisies et extraites":[[33,"data-entered-and-extracted"]],"D\u00e9boguer la configuration et les t\u00e2ches":[[41,"debug-configuration-tasks"]],"D\u00e9pannage":[[48,null]],"D\u00e9pendances principales":[[40,"main-dependencies"]],"D\u00e9ploiement":[[37,null]],"D\u00e9p\u00f4t du projet":[[21,"project-repository"]],"D\u00e9veloppement":[[41,"development"],[41,"id1"]],"Environnement de production":[[44,"prod-environment"]],"Environnements de d\u00e9veloppement":[[41,"dev-environment"],[44,"dev-environment"]],"Environnements de production":[[41,"production-environment"]],"FitTrackee":[[35,null]],"FitTrackee ne d\u00e9marre pas":[[47,"fittrackee-fails-to-start"]],"Flux":[[29,"flow"]],"Flux RSS":[[13,null]],"Flux de s\u00e9ances":[[16,null]],"Fonctionnalit\u00e9s":[[19,"features"],[19,"id235"],[19,"id245"],[19,"id255"],[27,null]],"Fonctionnalit\u00e9s et am\u00e9liorations":[[19,"features-and-enhancements"],[19,"id1"],[19,"id6"],[19,"id18"],[19,"id22"],[19,"id25"],[19,"id27"],[19,"id31"],[19,"id33"],[19,"id41"],[19,"id45"],[19,"id51"],[19,"id55"],[19,"id57"],[19,"id64"],[19,"id71"],[19,"id74"],[19,"id80"],[19,"id84"],[19,"id88"],[19,"id90"],[19,"id95"],[19,"id98"],[19,"id102"],[19,"id107"],[19,"id110"],[19,"id116"],[19,"id121"],[19,"id125"],[19,"id132"],[19,"id136"],[19,"id145"],[19,"id149"],[19,"id153"],[19,"id156"],[19,"id173"],[19,"id176"],[19,"id184"],[19,"id187"],[19,"id193"],[19,"id198"],[19,"id200"],[19,"id202"],[19,"id205"],[19,"id216"],[19,"id222"]],"Geocoding":[[6,null]],"Graphique":[[33,"chart"]],"Historique des modifications":[[19,null]],"Inscription et authentification":[[30,null]],"Installation":[[40,null],[41,null]],"Instance mono-utilisateur":[[40,"single-user-instance"]],"Instance multi-utilisateurs":[[40,"multiple-users-instance"]],"Instructions de mise \u00e0 jour":[[44,"instructions-for-upgrade"]],"Interactions":[[28,null]],"Interface de ligne de commande":[[20,null]],"La vitesse maximale de la s\u00e9ance ne correspond pas \u00e0 la vitesse maximale affich\u00e9e dans le graphique.":[[49,"workout-maximum-speed-does-not-match-the-maximum-speed-displayed-in-chart"]],"Les images de la carte ne sont pas affich\u00e9es mais la carte est affich\u00e9e dans le d\u00e9tail de la s\u00e9ance":[[47,"map-images-are-not-displayed-but-map-is-shown-in-workout-detail"]],"Limitation d'acc\u00e8s \u00e0 l'API":[[36,null]],"Liste des s\u00e9ances":[[34,null]],"Menu de la s\u00e9ance":[[33,"workout-menu"]],"Messages":[[22,"messages"]],"Mettre \u00e0 jour vers une version 1.0.x":[[44,"upgrading-to-1-0-x"]],"Mise \u00e0 jour":[[44,null]],"Mise \u00e0 jour des s\u00e9ances":[[44,"workouts-data-update"]],"Modification et suppression":[[33,"edition-and-deletion"]],"Mod\u00e9ration":[[22,"moderation"],[23,"moderation"],[28,"moderation"]],"Niveaux de visibilit\u00e9":[[33,"visibility-levels"]],"Notes techniques":[[33,null],[33,null]],"Notifications":[[8,null],[22,"notifications"],[28,"notifications"]],"Nouvelles fonctionnalit\u00e9s":[[19,"new-features"],[19,"id273"],[19,"id275"],[19,"id277"],[19,"id282"],[19,"id297"],[19,"id301"],[19,"id303"],[19,"id305"],[19,"id310"],[19,"id315"],[19,"id319"],[19,"id322"],[19,"id325"]],"OAuth 2.0":[[29,null]],"OAuth2":[[9,null],[20,"oauth2"]],"Outils d'importation":[[46,"import-tools"]],"Outils tiers":[[46,null]],"Par p\u00e9riode de temps":[[31,"by-time-period"]],"Par sport":[[31,"by-sport"]],"Philosophie":[[21,"philosophy"]],"Points d'acc\u00e8s :":[[7,null]],"Politique de confidentialit\u00e9":[[23,"privacy-policy"]],"Politique relative \u00e0 l'IA g\u00e9n\u00e9rative":[[21,"generative-ai-policy"]],"Production":[[41,"production"]],"Profil de l'utilisateur":[[28,"user-profile"]],"Pr\u00e9f\u00e9rences":[[22,"preferences"]],"Pr\u00e9f\u00e9rences des sports":[[22,"sports-preferences"]],"Pr\u00e9requis":[[40,"prerequisites"]],"Pull Requests":[[19,"pull-requests"],[19,"id229"],[19,"id232"],[19,"id248"],[19,"id257"],[19,"id261"],[19,"id265"],[19,"id280"],[21,"pull-requests"]],"Records":[[11,null],[33,"records"]],"Ressources":[[29,"resources"]],"RuntimeError: thread already started":[[47,"runtimeerror-thread-already-started"]],"R\u00e9pertoire des utilisateurs":[[28,"users-directory"]],"Scopes":[[29,"scopes"]],"Scripts d'installation":[[46,"installation-scripts"]],"Serveur de tuiles":[[42,null]],"Seuil de vitesse arr\u00eat\u00e9e":[[33,"stopped-speed-threshold"]],"Signalements":[[12,null]],"Signaler des probl\u00e8mes, demander des fonctionnalit\u00e9s":[[21,"report-issues-ask-for-features"]],"Sports":[[14,null],[23,"sports"],[33,"sports"]],"Sports d'hiver et de montagne":[[33,"winter-sports-and-mountain-sports"]],"Sports de raquette":[[33,"rackets-sports"]],"Sports disponibles":[[33,"sports-available"]],"Sports nautiques":[[33,"water-sports"]],"Sports p\u00e9destres":[[33,"foot-sports"]],"Statistiques":[[15,null],[31,null]],"S\u00e9ance":[[33,null]],"S\u00e9ances":[[18,null],[20,"workouts"]],"S\u00e9curit\u00e9":[[19,"security"]],"Table des mati\u00e8res":[[35,"table-of-contents"]],"Tableau de bord":[[24,null]],"Tickets Ferm\u00e9s":[[19,"issues-closed"],[19,"id227"],[19,"id230"],[19,"id234"],[19,"id238"],[19,"id241"],[19,"id244"],[19,"id246"],[19,"id250"],[19,"id252"],[19,"id254"],[19,"id259"],[19,"id263"],[19,"id266"],[19,"id268"],[19,"id270"],[19,"id272"],[19,"id274"],[19,"id276"],[19,"id281"],[19,"id284"],[19,"id286"],[19,"id289"],[19,"id291"],[19,"id293"],[19,"id296"],[19,"id300"],[19,"id302"],[19,"id304"],[19,"id307"],[19,"id309"],[19,"id312"],[19,"id314"],[19,"id318"],[19,"id321"],[19,"id324"]],"Traductions":[[19,"translations"],[19,"id4"],[19,"id8"],[19,"id11"],[19,"id13"],[19,"id16"],[19,"id20"],[19,"id30"],[19,"id32"],[19,"id35"],[19,"id38"],[19,"id40"],[19,"id43"],[19,"id46"],[19,"id48"],[19,"id50"],[19,"id53"],[19,"id56"],[19,"id59"],[19,"id61"],[19,"id63"],[19,"id65"],[19,"id66"],[19,"id69"],[19,"id73"],[19,"id76"],[19,"id78"],[19,"id82"],[19,"id86"],[19,"id93"],[19,"id97"],[19,"id105"],[19,"id108"],[19,"id112"],[19,"id115"],[19,"id118"],[19,"id119"],[19,"id123"],[19,"id126"],[19,"id129"],[19,"id130"],[19,"id134"],[19,"id138"],[19,"id141"],[19,"id143"],[19,"id147"],[19,"id151"],[19,"id155"],[19,"id158"],[19,"id161"],[19,"id165"],[19,"id170"],[19,"id175"],[19,"id178"],[19,"id180"],[19,"id183"],[19,"id186"],[19,"id189"],[19,"id192"],[19,"id195"],[19,"id196"],[19,"id199"],[19,"id201"],[19,"id203"],[19,"id204"],[19,"id207"],[19,"id209"],[19,"id212"],[19,"id214"],[19,"id218"],[19,"id219"],[19,"id221"],[19,"id224"],[19,"id237"],[21,"translations"],[32,null]],"Traitement des t\u00e2ches":[[43,null]],"Type d'instances":[[40,"instance-types"]],"Types d'\u00e9quipement":[[3,null],[23,"equipment-types"]],"T\u00e2ches en attente":[[10,null],[23,"queued-tasks"]],"Utilisateur":[[49,null]],"Utilisateurs":[[17,null],[20,"users"],[23,"users"],[28,"users"]],"VSCode":[[41,"vscode"]],"Variables d'environnement":[[39,null]],"Variables g\u00e9n\u00e9rales":[[39,"general-variables"]],"Version 0.1.0 - Premi\u00e8re version \ud83c\udf89 (04/07/2018)":[[19,"version-0-1-0-first-release-2018-07-04"]],"Version 0.1.1 - Corrections et am\u00e9liorations (07/02/2019)":[[19,"version-0-1-1-fix-and-improvements-2019-02-07"]],"Version 0.10.0 (29/05/2025)":[[19,"version-0-10-0-2025-05-29"]],"Version 0.10.0b1 (24/05/2025)":[[19,"version-0-10-0b1-2025-05-24"]],"Version 0.10.0b2 (24/05/2025)":[[19,"version-0-10-0b2-2025-05-24"]],"Version 0.10.1 (30/05/2025)":[[19,"version-0-10-1-2025-05-30"]],"Version 0.10.2 (31/05/2025)":[[19,"version-0-10-2-2025-05-31"]],"Version 0.10.3 (18/06/2025)":[[19,"version-0-10-3-2025-06-18"]],"Version 0.11.0 (23/07/2025)":[[19,"version-0-11-0-2025-07-23"]],"Version 0.11.1 (30/07/2025)":[[19,"version-0-11-1-2025-07-30"]],"Version 0.11.2 (13/08/2025)":[[19,"version-0-11-2-2025-08-13"]],"Version 0.12.0 (31/08/2025)":[[19,"version-0-12-0-2025-08-31"]],"Version 0.12.1 (03/09/2025)":[[19,"version-0-12-1-2025-09-03"]],"Version 0.12.2 (07/09/2025)":[[19,"version-0-12-2-2025-09-07"]],"Version 0.2.0 - Statistiques (07/07/2019)":[[19,"version-0-2-0-statistics-2019-07-07"]],"Version 0.2.1 - Correction et am\u00e9liorations (01/09/2019)":[[19,"version-0-2-1-fix-and-improvements-2019-09-01"]],"Version 0.2.2 - Corrections des statistiques (23/09/2019)":[[19,"version-0-2-2-statistics-fix-2019-09-23"]],"Version 0.2.3 - FitTrackee disponible en Fran\u00e7ais (29/12/2019)":[[19,"version-0-2-3-fittrackee-available-in-french-2019-12-29"]],"Version 0.2.4 - Corrections mineures (30/01/2020)":[[19,"version-0-2-4-minor-fix-2020-01-30"]],"Version 0.2.5 - Corrections et am\u00e9liorations (31/01/2020)":[[19,"version-0-2-5-fix-and-improvements-2020-01-31"]],"Version 0.3.0 - Administration (15/07/2020)":[[19,"version-0-3-0-administration-2020-07-15"]],"Version 0.4.0 - FitTrackee sur PyPI (19/09/2020)":[[19,"version-0-4-0-fittrackee-on-pypi-2020-09-19"]],"Version 0.4.1 (31/12/2020)":[[19,"version-0-4-1-2020-12-31"]],"Version 0.4.2 (03/01/2021)":[[19,"version-0-4-2-2021-01-03"]],"Version 0.4.3 (10/01/2021)":[[19,"version-0-4-3-2021-01-10"]],"Version 0.4.4 (31/01/2021)":[[19,"version-0-4-4-2021-01-31"]],"Version 0.4.5 (17/02/2021)":[[19,"version-0-4-5-2021-02-17"]],"Version 0.4.6 (21/02/2021)":[[19,"version-0-4-6-2021-02-21"]],"Version 0.4.7 (07/04/2021)":[[19,"version-0-4-7-2021-04-07"]],"Version 0.4.8 (03/07/2021)":[[19,"version-0-4-8-2021-07-03"]],"Version 0.4.9 (16/07/2021)":[[19,"version-0-4-9-2021-07-16"]],"Version 0.5.0 (14/11/2021)":[[19,"version-0-5-0-2021-11-14"]],"Version 0.5.1 (30/11/2021)":[[19,"version-0-5-1-2021-11-30"]],"Version 0.5.2 (19/12/2021)":[[19,"version-0-5-2-2021-12-19"]],"Version 0.5.3 (01/01/2022)":[[19,"version-0-5-3-2022-01-01"]],"Version 0.5.4 (01/01/2022)":[[19,"version-0-5-4-2022-01-01"]],"Version 0.5.5 (19/01/2022)":[[19,"version-0-5-5-2022-01-19"]],"Version 0.5.6 (05/02/2022)":[[19,"version-0-5-6-2022-02-05"]],"Version 0.5.7 (13/02/2022)":[[19,"version-0-5-7-2022-02-13"]],"Version 0.6.0 (27/03/2022)":[[19,"version-0-6-0-2022-03-27"]],"Version 0.6.1 (27/03/2022)":[[19,"version-0-6-1-2022-03-27"]],"Version 0.6.10 (13/07/2022)":[[19,"version-0-6-10-2022-07-13"]],"Version 0.6.11 (27/02/2022)":[[19,"version-0-6-11-2022-07-27"]],"Version 0.6.12 (14/09/2022)":[[19,"version-0-6-12-2022-09-14"]],"Version 0.6.2 (03/04/2022)":[[19,"version-0-6-2-2022-04-03"]],"Version 0.6.3 (09/04/2022)":[[19,"version-0-6-3-2022-04-09"]],"Version 0.6.4 (23/04/2022)":[[19,"version-0-6-4-2022-04-23"]],"Version 0.6.5 (24/04/2022)":[[19,"version-0-6-5-2022-04-24"]],"Version 0.6.6 (29/05/2022)":[[19,"version-0-6-6-2022-05-29"]],"Version 0.6.7 (11/06/2022)":[[19,"version-0-6-7-2022-06-11"]],"Version 0.6.8 (22/06/2022)":[[19,"version-0-6-8-2022-06-22"]],"Version 0.6.9 (03/07/2022)":[[19,"version-0-6-9-2022-07-03"]],"Version 0.7.0 (19/09/2022)":[[19,"version-0-7-0-2022-09-19"]],"Version 0.7.1 (21/09/2022)":[[19,"version-0-7-1-2022-09-21"]],"Version 0.7.10 (21/12/2022)":[[19,"version-0-7-10-2022-12-21"]],"Version 0.7.11 (31/12/2022)":[[19,"version-0-7-11-2022-12-31"]],"Version 0.7.12 (16/02/2023)":[[19,"version-0-7-12-2023-02-16"]],"Version 0.7.13 (05/03/2023)":[[19,"version-0-7-13-2023-03-05"]],"Version 0.7.14 (08/03/2023)":[[19,"version-0-7-14-2023-03-08"]],"Version 0.7.15 (12/04/2023)":[[19,"version-0-7-15-2023-04-12"]],"Version 0.7.16 (29/05/2023)":[[19,"version-0-7-16-2023-05-29"]],"Version 0.7.17 (03/06/2023)":[[19,"version-0-7-17-2023-06-03"]],"Version 0.7.18 (25/06/2023)":[[19,"version-0-7-18-2023-06-25"]],"Version 0.7.19 (15/07/2023)":[[19,"version-0-7-19-2023-07-15"]],"Version 0.7.2 (21/09/2022)":[[19,"version-0-7-2-2022-09-21"]],"Version 0.7.20 (22/07/2023)":[[19,"version-0-7-20-2023-07-22"]],"Version 0.7.21 (30/07/2023)":[[19,"version-0-7-21-2023-07-30"]],"Version 0.7.22 (23/08/2023)":[[19,"version-0-7-22-2023-08-23"]],"Version 0.7.23 (14/09/2023)":[[19,"version-0-7-23-2023-09-14"]],"Version 0.7.24 (04/10/2023)":[[19,"version-0-7-24-2023-10-04"]],"Version 0.7.25 (08/10/2023)":[[19,"version-0-7-25-2023-10-08"]],"Version 0.7.26 (19/11/2023)":[[19,"version-0-7-26-2023-11-19"]],"Version 0.7.27 (20/12/2023)":[[19,"version-0-7-27-2023-12-20"]],"Version 0.7.28 (23/12/2023)":[[19,"version-0-7-28-2023-12-23"]],"Version 0.7.29 (04/01/2024)":[[19,"version-0-7-29-2024-01-06"]],"Version 0.7.3 (01/11/2022)":[[19,"version-0-7-3-2022-11-01"]],"Version 0.7.30 (04/02/2024)":[[19,"version-0-7-30-2024-02-04"]],"Version 0.7.31 (10/02/2024)":[[19,"version-0-7-31-2024-02-10"]],"Version 0.7.32 (10/03/2024)":[[19,"version-0-7-32-2024-03-10"]],"Version 0.7.4 (05/11/2022)":[[19,"version-0-7-4-2022-11-05"]],"Version 0.7.5 (09/11/2022)":[[19,"version-0-7-5-2022-11-09"]],"Version 0.7.6 (09/11/2022)":[[19,"version-0-7-6-2022-11-09"]],"Version 0.7.7 (27/11/2022)":[[19,"version-0-7-7-2022-11-27"]],"Version 0.7.8 (30/11/2022)":[[19,"version-0-7-8-2022-11-30"]],"Version 0.7.9 (11/12/2022)":[[19,"version-0-7-9-2022-12-11"]],"Version 0.8.0 (21/04/2024)":[[19,"version-0-8-0-2024-04-21"]],"Version 0.8.1 (01/05/2024)":[[19,"version-0-8-1-2024-05-01"]],"Version 0.8.10 (09/10/2024)":[[19,"version-0-8-10-2024-10-09"]],"Version 0.8.11 (30/10/2024)":[[19,"version-0-8-11-2024-10-30"]],"Version 0.8.12 (17/11/2024)":[[19,"version-0-8-12-2024-11-17"]],"Version 0.8.13 (29/12/2024)":[[19,"version-0-8-13-2024-12-29"]],"Version 0.8.2 (08/05/2024)":[[19,"version-0-8-2-2024-05-08"]],"Version 0.8.3 (09/05/2024)":[[19,"version-0-8-3-2024-05-09"]],"Version 0.8.4 (22/05/2024)":[[19,"version-0-8-4-2024-05-22"]],"Version 0.8.5 (29/06/2024)":[[19,"version-0-8-5-2024-06-29"]],"Version 0.8.6 (03/08/2024)":[[19,"version-0-8-6-2024-08-03"]],"Version 0.8.7 (25/08/2024)":[[19,"version-0-8-7-2024-08-25"]],"Version 0.8.8 (01/09/2024)":[[19,"version-0-8-8-2024-09-01"]],"Version 0.8.9 (21/09/2024)":[[19,"version-0-8-9-2024-09-21"]],"Version 0.9.0 (18/01/2025)":[[19,"version-0-9-0-2025-01-18"]],"Version 0.9.0b1 (14/12/2024)":[[19,"version-0-9-0b1-2024-12-14"]],"Version 0.9.0b2 (14/12/2024)":[[19,"version-0-9-0b2-2024-12-14"]],"Version 0.9.0b3 (18/12/2024)":[[19,"version-0-9-0b3-2024-12-18"]],"Version 0.9.0b4 (23/12/2024)":[[19,"version-0-9-0b4-2024-12-23"]],"Version 0.9.0b5 (30/12/2024)":[[19,"version-0-9-0b5-2024-12-30"]],"Version 0.9.0b6 (05/01/2025)":[[19,"version-0-9-0b6-2025-01-05"]],"Version 0.9.1 (02/02/2025)":[[19,"version-0-9-1-2025-02-02"]],"Version 0.9.10 (11/05/2025)":[[19,"version-0-9-10-2025-05-11"]],"Version 0.9.11 (18/05/2025)":[[19,"version-0-9-11-2025-05-18"]],"Version 0.9.2 (12/02/2025)":[[19,"version-0-9-2-2025-02-12"]],"Version 0.9.3 (15/03/2025)":[[19,"version-0-9-3-2025-03-15"]],"Version 0.9.4 (26/03/2025)":[[19,"version-0-9-4-2025-03-26"]],"Version 0.9.5 (06/04/2025)":[[19,"version-0-9-5-2025-04-06"]],"Version 0.9.5 (16/04/2025)":[[19,"version-0-9-6-2025-04-16"]],"Version 0.9.7 (20/04/2025)":[[19,"version-0-9-7-2025-04-20"]],"Version 0.9.8 (27/04/2025)":[[19,"version-0-9-8-2025-04-27"]],"Version 0.9.9 (03/05/2025)":[[19,"version-0-9-9-2025-05-03"]],"Version 1.0.0 (05/10/2025)":[[19,"version-1-0-0-2025-10-05"]],"Version 1.0.0b1 (10/09/2025)":[[19,"version-1-0-0b1-2025-09-10"]],"Version 1.0.0b2 (21/09/2025)":[[19,"version-1-0-0b2-2025-09-21"]],"Version 1.0.0b3 (27/09/2025)":[[19,"version-1-0-0b3-2025-09-27"]],"Version 1.0.1 (22/10/2025)":[[19,"version-1-0-1-2025-10-22"]],"Version 1.0.2 (01/11/2025)":[[19,"version-1-0-2-2025-11-01"]],"Version 1.0.3 (05/11/2025)":[[19,"version-1-0-3-2025-11-05"]],"Version 1.0.4 (14/12/2025)":[[19,"version-1-0-4-2025-12-14"]],"Version 1.0.5 (27/12/2025)":[[19,"version-1-0-5-2025-12-27"]],"Version 1.0.6 (04/01/2026)":[[19,"version-1-0-6-2026-01-04"]],"Version 1.1.0b1 (04/01/2026)":[[19,"version-1-1-0b1-2026-01-04"]],"Version 1.1.0b2 (11/01/2026)":[[19,"version-1-1-0b2-2026-01-11"]],"V\u00e9lo (Sport)":[[33,"cycle-sports"]],"ftcli db drop":[[20,"ftcli-db-drop"]],"ftcli db upgrade":[[20,"ftcli-db-upgrade"]],"ftcli oauth2 clean":[[20,"ftcli-oauth2-clean"]],"ftcli users clean_archives":[[20,"ftcli-users-clean-archives"]],"ftcli users clean_tokens":[[20,"ftcli-users-clean-tokens"]],"ftcli users create":[[20,"ftcli-users-create"]],"ftcli users export_archive":[[20,"ftcli-users-export-archive"]],"ftcli users export_archives":[[20,"ftcli-users-export-archives"]],"ftcli users update":[[20,"ftcli-users-update"]],"ftcli workouts archive_upload":[[20,"ftcli-workouts-archive-upload"]],"ftcli workouts archive_uploads":[[20,"ftcli-workouts-archive-uploads"]],"ftcli workouts refresh":[[20,"ftcli-workouts-refresh"]],"psycopg2.errors.UndefinedObject: ERROR:  type \"geometry\" does not exist":[[47,"psycopg2-errors-undefinedobject-error-type-geometry-does-not-exist"]],"staticmap3.staticmap - ERROR - request failed [None] ou \"Erreur lors de la g\u00e9n\u00e9ration de l'image de la carte\"":[[47,"staticmap3-staticmap-error-request-failed-none-or-error-when-generating-map-image"]],"\u00c9chec du chargement ou du t\u00e9l\u00e9chargement de fichiers":[[47,"failed-to-upload-or-download-files"]],"\u00c9quipements":[[4,null],[25,null]]},"docnames":["api/auth","api/comments","api/configuration","api/equipment_types","api/equipments","api/follow_requests","api/geocode","api/index","api/notifications","api/oauth2","api/queued_tasks","api/records","api/reports","api/rss_feeds","api/sports","api/stats","api/timeline","api/users","api/workouts","changelog","cli","contributing","features/account_and_preferences","features/administration","features/dashboard","features/equipment","features/global_map","features/index","features/interactions","features/oauth","features/registration_authentication","features/statistics","features/translations","features/workout","features/workouts_list","index","installation/api_rate_limits","installation/deployment","installation/emails","installation/environments_variables","installation/index","installation/installation","installation/map_tile_server","installation/tasks_processing","installation/upgrade","installation/weather","third_party_tools","troubleshooting/administrator","troubleshooting/index","troubleshooting/user"],"envversion":{"sphinx":65,"sphinx.domains.c":3,"sphinx.domains.changeset":1,"sphinx.domains.citation":1,"sphinx.domains.cpp":9,"sphinx.domains.index":1,"sphinx.domains.javascript":3,"sphinx.domains.math":2,"sphinx.domains.python":4,"sphinx.domains.rst":2,"sphinx.domains.std":2},"filenames":["api/auth.rst","api/comments.rst","api/configuration.rst","api/equipment_types.rst","api/equipments.rst","api/follow_requests.rst","api/geocode.rst","api/index.rst","api/notifications.rst","api/oauth2.rst","api/queued_tasks.rst","api/records.rst","api/reports.rst","api/rss_feeds.rst","api/sports.rst","api/stats.rst","api/timeline.rst","api/users.rst","api/workouts.rst","changelog.md","cli.rst","contributing.md","features/account_and_preferences.rst","features/administration.rst","features/dashboard.rst","features/equipment.rst","features/global_map.rst","features/index.rst","features/interactions.rst","features/oauth.rst","features/registration_authentication.rst","features/statistics.rst","features/translations.rst","features/workout.rst","features/workouts_list.rst","index.rst","installation/api_rate_limits.rst","installation/deployment.rst","installation/emails.rst","installation/environments_variables.rst","installation/index.rst","installation/installation.rst","installation/map_tile_server.rst","installation/tasks_processing.rst","installation/upgrade.rst","installation/weather.rst","third_party_tools.rst","troubleshooting/administrator.rst","troubleshooting/index.rst","troubleshooting/user.rst"],"indexentries":{"api_rate_limits":[[39,"envvar-API_RATE_LIMITS",false]],"app_log":[[39,"envvar-APP_LOG",false]],"app_secret_key":[[39,"envvar-APP_SECRET_KEY",false]],"app_settings":[[39,"envvar-APP_SETTINGS",false]],"app_timeout":[[39,"envvar-APP_TIMEOUT",false]],"app_workers":[[39,"envvar-APP_WORKERS",false]],"database_disable_pooling":[[39,"envvar-DATABASE_DISABLE_POOLING",false]],"database_url":[[39,"envvar-DATABASE_URL",false]],"default_staticmap":[[39,"envvar-DEFAULT_STATICMAP",false]],"dramatiq_log":[[39,"envvar-DRAMATIQ_LOG",false]],"email_url":[[39,"envvar-EMAIL_URL",false]],"enable_geospatial_features":[[39,"envvar-ENABLE_GEOSPATIAL_FEATURES",false]],"flask_app":[[39,"envvar-FLASK_APP",false]],"host":[[39,"envvar-HOST",false]],"host_app_port":[[39,"envvar-HOST_APP_PORT",false]],"host_database_dir":[[39,"envvar-HOST_DATABASE_DIR",false]],"host_log_dir":[[39,"envvar-HOST_LOG_DIR",false]],"host_redis_dir":[[39,"envvar-HOST_REDIS_DIR",false]],"host_staticmap_cache_dir":[[39,"envvar-HOST_STATICMAP_CACHE_DIR",false]],"host_upload_dir":[[39,"envvar-HOST_UPLOAD_DIR",false]],"log_level":[[39,"envvar-LOG_LEVEL",false]],"map_attribution":[[39,"envvar-MAP_ATTRIBUTION",false]],"nominatim_url":[[39,"envvar-NOMINATIM_URL",false]],"open_elevation_api_url":[[39,"envvar-OPEN_ELEVATION_API_URL",false]],"port":[[39,"envvar-PORT",false]],"postgres_db":[[39,"envvar-POSTGRES_DB",false]],"postgres_password":[[39,"envvar-POSTGRES_PASSWORD",false]],"postgres_user":[[39,"envvar-POSTGRES_USER",false]],"redis_url":[[39,"envvar-REDIS_URL",false]],"sender_email":[[39,"envvar-SENDER_EMAIL",false]],"staticmap_cache_dir":[[39,"envvar-STATICMAP_CACHE_DIR",false]],"staticmap_subdomains":[[39,"envvar-STATICMAP_SUBDOMAINS",false]],"tasks_time_limit":[[39,"envvar-TASKS_TIME_LIMIT",false]],"tile_server_url":[[39,"envvar-TILE_SERVER_URL",false]],"ui_url":[[39,"envvar-UI_URL",false]],"upload_folder":[[39,"envvar-UPLOAD_FOLDER",false]],"valhalla_api_url":[[39,"envvar-VALHALLA_API_URL",false]],"variable d'environnement":[[39,"envvar-API_RATE_LIMITS",false],[39,"envvar-APP_LOG",false],[39,"envvar-APP_SECRET_KEY",false],[39,"envvar-APP_SETTINGS",false],[39,"envvar-APP_TIMEOUT",false],[39,"envvar-APP_WORKERS",false],[39,"envvar-DATABASE_DISABLE_POOLING",false],[39,"envvar-DATABASE_URL",false],[39,"envvar-DEFAULT_STATICMAP",false],[39,"envvar-DRAMATIQ_LOG",false],[39,"envvar-EMAIL_URL",false],[39,"envvar-ENABLE_GEOSPATIAL_FEATURES",false],[39,"envvar-FLASK_APP",false],[39,"envvar-HOST",false],[39,"envvar-HOST_APP_PORT",false],[39,"envvar-HOST_DATABASE_DIR",false],[39,"envvar-HOST_LOG_DIR",false],[39,"envvar-HOST_REDIS_DIR",false],[39,"envvar-HOST_STATICMAP_CACHE_DIR",false],[39,"envvar-HOST_UPLOAD_DIR",false],[39,"envvar-LOG_LEVEL",false],[39,"envvar-MAP_ATTRIBUTION",false],[39,"envvar-NOMINATIM_URL",false],[39,"envvar-OPEN_ELEVATION_API_URL",false],[39,"envvar-PORT",false],[39,"envvar-POSTGRES_DB",false],[39,"envvar-POSTGRES_PASSWORD",false],[39,"envvar-POSTGRES_USER",false],[39,"envvar-REDIS_URL",false],[39,"envvar-SENDER_EMAIL",false],[39,"envvar-STATICMAP_CACHE_DIR",false],[39,"envvar-STATICMAP_SUBDOMAINS",false],[39,"envvar-TASKS_TIME_LIMIT",false],[39,"envvar-TILE_SERVER_URL",false],[39,"envvar-UI_URL",false],[39,"envvar-UPLOAD_FOLDER",false],[39,"envvar-VALHALLA_API_URL",false],[39,"envvar-VITE_APP_API_URL",false],[39,"envvar-WEATHER_API_KEY",false],[39,"envvar-WEATHER_API_PROVIDER",false],[39,"envvar-WORKERS_PROCESSES",false]],"vite_app_api_url":[[39,"envvar-VITE_APP_API_URL",false]],"weather_api_key":[[39,"envvar-WEATHER_API_KEY",false]],"weather_api_provider":[[39,"envvar-WEATHER_API_PROVIDER",false]],"workers_processes":[[39,"envvar-WORKERS_PROCESSES",false]]},"objects":{"":[[12,0,1,"patch--api-appeals-(string-appeal_id)","/api/appeals/(string:appeal_id)"],[0,1,1,"post--api-auth-account-confirm","/api/auth/account/confirm"],[0,2,1,"get--api-auth-account-export","/api/auth/account/export"],[0,2,1,"get--api-auth-account-export-(string-file_name)","/api/auth/account/export/(string:file_name)"],[0,1,1,"post--api-auth-account-export-request","/api/auth/account/export/request"],[0,1,1,"post--api-auth-account-privacy-policy","/api/auth/account/privacy-policy"],[0,1,1,"post--api-auth-account-resend-confirmation","/api/auth/account/resend-confirmation"],[0,2,1,"get--api-auth-account-sanctions-(string-action_short_id)","/api/auth/account/sanctions/(string:action_short_id)"],[0,1,1,"post--api-auth-account-sanctions-(string-action_short_id)-appeal","/api/auth/account/sanctions/(string:action_short_id)/appeal"],[0,2,1,"get--api-auth-account-suspension","/api/auth/account/suspension"],[0,1,1,"post--api-auth-account-suspension-appeal","/api/auth/account/suspension/appeal"],[0,2,1,"get--api-auth-blocked-users","/api/auth/blocked-users"],[0,1,1,"post--api-auth-email-update","/api/auth/email/update"],[0,1,1,"post--api-auth-login","/api/auth/login"],[0,1,1,"post--api-auth-logout","/api/auth/logout"],[0,1,1,"post--api-auth-password-reset-request","/api/auth/password/reset-request"],[0,1,1,"post--api-auth-password-update","/api/auth/password/update"],[0,3,1,"delete--api-auth-picture","/api/auth/picture"],[0,1,1,"post--api-auth-picture","/api/auth/picture"],[0,2,1,"get--api-auth-profile","/api/auth/profile"],[0,1,1,"post--api-auth-profile-edit","/api/auth/profile/edit"],[0,0,1,"patch--api-auth-profile-edit-account","/api/auth/profile/edit/account"],[0,1,1,"post--api-auth-profile-edit-messages","/api/auth/profile/edit/messages"],[0,1,1,"post--api-auth-profile-edit-notifications","/api/auth/profile/edit/notifications"],[0,1,1,"post--api-auth-profile-edit-preferences","/api/auth/profile/edit/preferences"],[0,0,1,"patch--api-auth-profile-edit-sports","/api/auth/profile/edit/sports"],[0,1,1,"post--api-auth-profile-edit-sports","/api/auth/profile/edit/sports"],[0,3,1,"delete--api-auth-profile-reset-sports-(sport_id)","/api/auth/profile/reset/sports/(sport_id)"],[0,1,1,"post--api-auth-register","/api/auth/register"],[0,2,1,"get--api-auth-timezones","/api/auth/timezones"],[1,3,1,"delete--api-comments-(string-comment_short_id)","/api/comments/(string:comment_short_id)"],[1,2,1,"get--api-comments-(string-comment_short_id)","/api/comments/(string:comment_short_id)"],[1,0,1,"patch--api-comments-(string-comment_short_id)","/api/comments/(string:comment_short_id)"],[1,1,1,"post--api-comments-(string-comment_short_id)-like","/api/comments/(string:comment_short_id)/like"],[1,1,1,"post--api-comments-(string-comment_short_id)-like-undo","/api/comments/(string:comment_short_id)/like/undo"],[1,2,1,"get--api-comments-(string-comment_short_id)-likes","/api/comments/(string:comment_short_id)/likes"],[1,1,1,"post--api-comments-(string-comment_short_id)-suspension-appeal","/api/comments/(string:comment_short_id)/suspension/appeal"],[2,2,1,"get--api-config","/api/config"],[2,0,1,"patch--api-config","/api/config"],[3,2,1,"get--api-equipment-types","/api/equipment-types"],[3,2,1,"get--api-equipment-types-(int-equipment_type_id)","/api/equipment-types/(int:equipment_type_id)"],[3,0,1,"patch--api-equipment-types-(int-equipment_type_id)","/api/equipment-types/(int:equipment_type_id)"],[4,2,1,"get--api-equipments","/api/equipments"],[4,1,1,"post--api-equipments","/api/equipments"],[4,3,1,"delete--api-equipments-(string-equipment_short_id)","/api/equipments/(string:equipment_short_id)"],[4,2,1,"get--api-equipments-(string-equipment_short_id)","/api/equipments/(string:equipment_short_id)"],[4,0,1,"patch--api-equipments-(string-equipment_short_id)","/api/equipments/(string:equipment_short_id)"],[4,1,1,"post--api-equipments-(string-equipment_short_id)-refresh","/api/equipments/(string:equipment_short_id)/refresh"],[5,2,1,"get--api-follow-requests","/api/follow-requests"],[5,1,1,"post--api-follow-requests-(user_name)-accept","/api/follow-requests/(user_name)/accept"],[5,1,1,"post--api-follow-requests-(user_name)-reject","/api/follow-requests/(user_name)/reject"],[6,2,1,"get--api-geocode-lookup","/api/geocode/lookup"],[6,2,1,"get--api-geocode-search","/api/geocode/search"],[8,2,1,"get--api-notifications","/api/notifications"],[8,0,1,"patch--api-notifications-(string-notification_id)","/api/notifications/(string:notification_id)"],[8,1,1,"post--api-notifications-mark-all-as-read","/api/notifications/mark-all-as-read"],[8,2,1,"get--api-notifications-types","/api/notifications/types"],[8,2,1,"get--api-notifications-unread","/api/notifications/unread"],[9,2,1,"get--api-oauth-apps","/api/oauth/apps"],[9,1,1,"post--api-oauth-apps","/api/oauth/apps"],[9,3,1,"delete--api-oauth-apps-(int-client_id)","/api/oauth/apps/(int:client_id)"],[9,2,1,"get--api-oauth-apps-(int-client_id)-by_id","/api/oauth/apps/(int:client_id)/by_id"],[9,1,1,"post--api-oauth-apps-(int-client_id)-revoke","/api/oauth/apps/(int:client_id)/revoke"],[9,2,1,"get--api-oauth-apps-(string-client_client_id)","/api/oauth/apps/(string:client_client_id)"],[9,1,1,"post--api-oauth-authorize","/api/oauth/authorize"],[9,1,1,"post--api-oauth-revoke","/api/oauth/revoke"],[9,1,1,"post--api-oauth-token","/api/oauth/token"],[2,2,1,"get--api-ping","/api/ping"],[11,2,1,"get--api-records","/api/records"],[12,2,1,"get--api-reports","/api/reports"],[12,1,1,"post--api-reports","/api/reports"],[12,2,1,"get--api-reports-(int-report_id)","/api/reports/(int:report_id)"],[12,0,1,"patch--api-reports-(int-report_id)","/api/reports/(int:report_id)"],[12,1,1,"post--api-reports-(int-report_id)-actions","/api/reports/(int:report_id)/actions"],[12,2,1,"get--api-reports-unresolved","/api/reports/unresolved"],[14,2,1,"get--api-sports","/api/sports"],[14,2,1,"get--api-sports-(int-sport_id)","/api/sports/(int:sport_id)"],[14,0,1,"patch--api-sports-(int-sport_id)","/api/sports/(int:sport_id)"],[15,2,1,"get--api-stats-(user_name)-by_sport","/api/stats/(user_name)/by_sport"],[15,2,1,"get--api-stats-(user_name)-by_time","/api/stats/(user_name)/by_time"],[15,2,1,"get--api-stats-all","/api/stats/all"],[16,2,1,"get--api-timeline","/api/timeline"],[17,2,1,"get--api-users","/api/users"],[17,3,1,"delete--api-users-(user_name)","/api/users/(user_name)"],[17,2,1,"get--api-users-(user_name)","/api/users/(user_name)"],[17,0,1,"patch--api-users-(user_name)","/api/users/(user_name)"],[17,1,1,"post--api-users-(user_name)-block","/api/users/(user_name)/block"],[17,1,1,"post--api-users-(user_name)-follow","/api/users/(user_name)/follow"],[17,2,1,"get--api-users-(user_name)-followers","/api/users/(user_name)/followers"],[17,2,1,"get--api-users-(user_name)-following","/api/users/(user_name)/following"],[17,2,1,"get--api-users-(user_name)-picture","/api/users/(user_name)/picture"],[17,2,1,"get--api-users-(user_name)-sanctions","/api/users/(user_name)/sanctions"],[17,1,1,"post--api-users-(user_name)-unblock","/api/users/(user_name)/unblock"],[17,1,1,"post--api-users-(user_name)-unfollow","/api/users/(user_name)/unfollow"],[17,2,1,"get--api-users-(user_name)-workouts","/api/users/(user_name)/workouts"],[10,2,1,"get--api-users-tasks-queued","/api/users/tasks/queued"],[10,2,1,"get--api-users-tasks-queued-(string-task_type)","/api/users/tasks/queued/(string:task_type)"],[18,2,1,"get--api-workouts","/api/workouts"],[18,1,1,"post--api-workouts","/api/workouts"],[18,3,1,"delete--api-workouts-(string-workout_short_id)","/api/workouts/(string:workout_short_id)"],[18,2,1,"get--api-workouts-(string-workout_short_id)","/api/workouts/(string:workout_short_id)"],[18,0,1,"patch--api-workouts-(string-workout_short_id)","/api/workouts/(string:workout_short_id)"],[18,2,1,"get--api-workouts-(string-workout_short_id)-chart_data","/api/workouts/(string:workout_short_id)/chart_data"],[18,2,1,"get--api-workouts-(string-workout_short_id)-chart_data-segment-(string-segment_short_id)","/api/workouts/(string:workout_short_id)/chart_data/segment/(string:segment_short_id)"],[1,2,1,"get--api-workouts-(string-workout_short_id)-comments","/api/workouts/(string:workout_short_id)/comments"],[1,1,1,"post--api-workouts-(string-workout_short_id)-comments","/api/workouts/(string:workout_short_id)/comments"],[18,2,1,"get--api-workouts-(string-workout_short_id)-geojson","/api/workouts/(string:workout_short_id)/geojson"],[18,2,1,"get--api-workouts-(string-workout_short_id)-geojson-segment-(string-segment_short_id)","/api/workouts/(string:workout_short_id)/geojson/segment/(string:segment_short_id)"],[18,2,1,"get--api-workouts-(string-workout_short_id)-gpx","/api/workouts/(string:workout_short_id)/gpx"],[18,2,1,"get--api-workouts-(string-workout_short_id)-gpx-download","/api/workouts/(string:workout_short_id)/gpx/download"],[18,2,1,"get--api-workouts-(string-workout_short_id)-gpx-segment-(int-segment_id)","/api/workouts/(string:workout_short_id)/gpx/segment/(int:segment_id)"],[18,1,1,"post--api-workouts-(string-workout_short_id)-like","/api/workouts/(string:workout_short_id)/like"],[18,1,1,"post--api-workouts-(string-workout_short_id)-like-undo","/api/workouts/(string:workout_short_id)/like/undo"],[18,2,1,"get--api-workouts-(string-workout_short_id)-likes","/api/workouts/(string:workout_short_id)/likes"],[18,2,1,"get--api-workouts-(string-workout_short_id)-original-download","/api/workouts/(string:workout_short_id)/original/download"],[18,1,1,"post--api-workouts-(string-workout_short_id)-refresh","/api/workouts/(string:workout_short_id)/refresh"],[18,1,1,"post--api-workouts-(string-workout_short_id)-suspension-appeal","/api/workouts/(string:workout_short_id)/suspension/appeal"],[18,2,1,"get--api-workouts-collection","/api/workouts/collection"],[18,2,1,"get--api-workouts-global-map","/api/workouts/global-map"],[18,2,1,"get--api-workouts-map-(map_id)","/api/workouts/map/(map_id)"],[18,1,1,"post--api-workouts-no_gpx","/api/workouts/no_gpx"],[18,2,1,"get--api-workouts-upload-tasks","/api/workouts/upload-tasks"],[18,3,1,"delete--api-workouts-upload-tasks-(string-task_short_id)","/api/workouts/upload-tasks/(string:task_short_id)"],[18,2,1,"get--api-workouts-upload-tasks-(string-task_short_id)","/api/workouts/upload-tasks/(string:task_short_id)"],[18,1,1,"post--api-workouts-upload-tasks-(string-task_short_id)-abort","/api/workouts/upload-tasks/(string:task_short_id)/abort"],[39,4,1,"-","API_RATE_LIMITS"],[39,4,1,"-","APP_LOG"],[39,4,1,"-","APP_SECRET_KEY"],[39,4,1,"-","APP_SETTINGS"],[39,4,1,"-","APP_TIMEOUT"],[39,4,1,"-","APP_WORKERS"],[39,4,1,"-","DATABASE_DISABLE_POOLING"],[39,4,1,"-","DATABASE_URL"],[39,4,1,"-","DEFAULT_STATICMAP"],[39,4,1,"-","DRAMATIQ_LOG"],[39,4,1,"-","EMAIL_URL"],[39,4,1,"-","ENABLE_GEOSPATIAL_FEATURES"],[39,4,1,"-","FLASK_APP"],[39,4,1,"-","HOST"],[39,4,1,"-","HOST_APP_PORT"],[39,4,1,"-","HOST_DATABASE_DIR"],[39,4,1,"-","HOST_LOG_DIR"],[39,4,1,"-","HOST_REDIS_DIR"],[39,4,1,"-","HOST_STATICMAP_CACHE_DIR"],[39,4,1,"-","HOST_UPLOAD_DIR"],[39,4,1,"-","LOG_LEVEL"],[39,4,1,"-","MAP_ATTRIBUTION"],[39,4,1,"-","NOMINATIM_URL"],[39,4,1,"-","OPEN_ELEVATION_API_URL"],[39,4,1,"-","PORT"],[39,4,1,"-","POSTGRES_DB"],[39,4,1,"-","POSTGRES_PASSWORD"],[39,4,1,"-","POSTGRES_USER"],[39,4,1,"-","REDIS_URL"],[39,4,1,"-","SENDER_EMAIL"],[39,4,1,"-","STATICMAP_CACHE_DIR"],[39,4,1,"-","STATICMAP_SUBDOMAINS"],[39,4,1,"-","TASKS_TIME_LIMIT"],[39,4,1,"-","TILE_SERVER_URL"],[39,4,1,"-","UI_URL"],[39,4,1,"-","UPLOAD_FOLDER"],[39,4,1,"-","VALHALLA_API_URL"],[39,4,1,"-","VITE_APP_API_URL"],[39,4,1,"-","WEATHER_API_KEY"],[39,4,1,"-","WEATHER_API_PROVIDER"],[39,4,1,"-","WORKERS_PROCESSES"]],"/api/workouts/map_tile/(s)/(z)/(x)/(y)":[[18,2,1,"get--api-workouts-map_tile-(s)-(z)-(x)-(y).png","png"]],"/users/(string:user_name)/workouts":[[13,2,1,"get--users-(string-user_name)-workouts.rss","rss"]]},"objnames":{"0":["http","patch","HTTP patch"],"1":["http","post","HTTP post"],"2":["http","get","HTTP get"],"3":["http","delete","HTTP delete"],"4":["std","envvar","variable d'environnement"]},"objtypes":{"0":"http:patch","1":"http:post","2":"http:get","3":"http:delete","4":"std:envvar"},"terms":{"0":[0,1,2,3,4,5,6,8,9,10,11,12,14,15,16,17,18,20,22,23,24,25,26,27,28,30,31,32,33,34,36,37,38,39,40,41,42,43,45,47],"00":[0,1,4,5,11,16,17,18],"000000":0,"01":[0,1,10,11,12,15,16,17,18],"02":[5,17,18],"029":11,"03":[17,18],"04":[0,8,12,16,17,18],"05":11,"06":[4,8,9,11,15,17],"0667062":9,"06ba975":19,"07":[0,8,11,16,17,18],"07355":18,"07356":18,"07358":18,"07361":18,"07364":18,"07367":18,"07368":18,"0737":18,"07377":18,"07381":18,"07385":18,"0739":18,"07399":18,"07402":18,"07408":18,"07423":18,"07425":18,"07434":18,"07435":18,"07442":18,"075aeb9":19,"0786a57":19,"08":[0,4,8,11,16,17,18],"09":[0,1,8,12,17,18],"0b2":[2,41,44],"0beta2":19,"0c5e44b":19,"0fd49176728a":10,"0mb":[0,18],"1":[0,1,2,3,4,5,6,8,9,10,11,12,13,14,15,16,17,18,20,22,23,25,26,28,29,31,32,33,34,36,37,39,40,41,47],"10":[0,1,2,4,5,8,11,16,17,18,20,22,23,25,32,33,39,40,42,43,47],"100":[18,19,24],"1000":[15,44],"10000":[2,18,23],"1001":19,"1002":19,"1003":19,"1004":19,"1007":19,"1009":19,"101":[15,19],"1015":19,"1018":19,"1020":19,"1022":19,"1025":19,"1026":19,"1027":19,"1030":19,"1031":19,"104":[18,19],"1048576":2,"10485760":2,"106":19,"109":19,"11":[0,11,17,18,22,25,33,39,45],"112":19,"113":19,"115":19,"116":19,"117":19,"12":[0,11,12,17,18,20,28,33,41,46],"121":19,"122":19,"123":19,"1232004":18,"12341":15,"1234538":18,"1239":8,"125":19,"126":19,"1267":15,"127":[19,37,39],"129":19,"12fb835fa26c":8,"13":[0,1,11,15,16,17,18,20,22,23,30,33,38,39,41,47],"1300":15,"131":19,"134":19,"135":19,"1354":15,"1375986":19,"138":19,"14":[0,1,9,10,11,16,17,18,33,40],"140":19,"141d3978536a":19,"143":19,"145":19,"146":19,"149":19,"15":[11,15,18,20,22,32,33,34,45],"150":15,"151":19,"152":19,"155":19,"156":[15,19],"1563529507772":18,"158":18,"16":[1,15,17,18,22,33],"160":19,"161":19,"162":19,"1658660147":9,"1663f64":19,"167":19,"169":19,"17":[0,5,10,12,16,17,18,33,44],"171":19,"173":19,"174240":19,"175":19,"177":19,"178":[15,19],"18":[0,12,17,18,32,33],"180":19,"1800":[39,43],"189071":19,"19":[18,33],"190":19,"191":19,"192":19,"193":19,"194":19,"195":19,"196":19,"197":19,"1d6f48c":19,"1f8ca78":19,"1m":37,"1mb":37,"1st":19,"2":[0,1,2,3,4,5,6,8,9,11,12,14,15,16,17,18,22,27,31,32,33,39,40,41,42,43,47],"20":[11,17,18,33,40],"200":[0,1,2,3,4,5,6,8,9,10,11,12,13,14,15,16,17,18,19,36],"201":[0,1,4,12,18,19],"2016":18,"2017":[1,15,17,18],"2018":[15,16,17,18],"2019":[0,11,15,16,17,18],"2021":[5,17],"2022":9,"2023":[0,4,17,45],"2024":[0,1,8,10,12,17,18],"2025":[10,18],"203":15,"204":[0,1,4,9,17,18],"208":[18,19],"209":19,"21":[4,10,12,33],"210":19,"212":19,"213":19,"2147483647":2,"21750":10,"22":[18,33],"223":19,"224":19,"225":19,"23":[18,33,39,42],"230":19,"231":[18,19],"232":19,"234":18,"236":19,"237":19,"239":19,"24":[1,10,11,15,18,33,38],"241":19,"242":19,"244":19,"246":19,"247":19,"25":[12,18,33,38,41],"250":[15,19],"252":19,"255":18,"257":19,"258":19,"259":19,"26":[18,33,39],"260":19,"261":19,"2612cd9":19,"264":19,"265":19,"266":19,"26and":38,"27":[0,9,10,12,17,18,22,33],"270":19,"271":19,"273":19,"274":19,"275":19,"278":19,"279":[18,19],"28":4,"280":[18,19],"282":[15,19],"287":19,"289":19,"29":[4,12],"290":19,"2930":18,"294":19,"296":19,"297":19,"298":19,"299":19,"2bc97bd":19,"2bcff2e":19,"2e1ee2c":19,"2e9f9d":19,"2ordfncv6vprkfp3yrcyht":[1,18],"2ukrviyshoakg8qsuknus4":4,"2ule2hwhsnycs2vhbsikb9":17,"3":[0,1,3,14,15,16,17,18,22,23,25,31,32,33,34,38,39,40,41,43,44,47],"30":[0,10,12,15,18,39,40,43],"300":36,"3000":[26,41],"301":[19,37],"302":19,"304":19,"305":19,"307":19,"308":19,"31":[0,1,17,18,32,41,45],"310":19,"314":19,"315":19,"318":19,"319":19,"32":18,"320":19,"3200410":6,"323":19,"328":19,"329":19,"32a0ca1":19,"33":[15,19],"3320":15,"333":19,"338":19,"34":[1,19],"34614d5":19,"35":[0,8,18,19],"350":19,"351":19,"352":19,"354":19,"3542fd2d":10,"355":19,"356":19,"357":19,"358":19,"359":19,"36":19,"365":19,"366":19,"367":19,"369":19,"37":19,"370":19,"371":19,"374":19,"375":19,"376":19,"377":19,"38":[12,19],"380":19,"381":19,"382":19,"3821e37":19,"3827067":19,"384":19,"386":19,"388":19,"38ef7a2":19,"39":[18,19],"390":19,"391":19,"393":19,"394":19,"395":19,"397":19,"398":19,"399":19,"3aread":29,"3awrit":29,"3b6fa25":19,"3c8d9c2":19,"3f":38,"4":[0,3,14,15,16,17,18,20,21,23,28,30,32,33,34,36,39,40,41,42],"40":19,"400":[0,1,2,3,4,5,9,10,12,14,15,17,18,19],"401":[0,1,2,3,4,5,6,8,9,10,11,12,14,15,16,17,18,19],"402":19,"403":[0,1,2,3,4,5,6,8,9,10,11,12,14,15,16,17,18],"404":[0,1,3,4,5,8,9,12,13,14,15,17,18,19],"406":19,"407":19,"409":19,"40and":38,"41":[18,19],"410":[18,19],"4109":18,"411":19,"413":[0,18],"415":19,"416":19,"417":19,"418":19,"42":[18,19],"421":19,"422":19,"426":19,"427":[18,19],"428":19,"43":[0,16,17,18,19],"431":19,"433":19,"435":18,"436":19,"438":19,"438f":10,"44":[17,18,19],"441":19,"443":37,"444":19,"449":19,"44ff":8,"45":[0,1,17,18,19],"450":19,"455":19,"456":19,"46":[15,19],"464":19,"465":38,"468":19,"469":19,"47":[15,18,19],"471":19,"472":19,"473":19,"474":19,"475":19,"476":19,"477":19,"478":[18,19],"479":19,"48":[5,6,15,17,19],"481":19,"482":19,"484":19,"488":19,"489":19,"49":[0,10,12,17],"490":19,"494":19,"495":19,"496":19,"499":[18,19],"4c3fc34":19,"5":[3,9,11,13,14,15,17,18,20,22,23,28,31,33,36,38,39,41,44],"50":[0,4,5,15,17,19,36],"500":[0,1,2,3,4,5,6,8,12,14,16,17,18,19],"5000":[37,39,41],"50000":23,"5001":41,"502":19,"504":19,"506":19,"507":19,"5078118":18,"5079733":18,"508":19,"51":[16,17,18,19],"510":19,"511":19,"512":19,"517587":18,"51758b4":19,"52":[1,18,19],"521":19,"524":19,"5248e79":19,"526":19,"527":19,"528":19,"529":19,"53":[9,10,19],"530":19,"531":19,"532":19,"533":19,"534":19,"536":19,"537":19,"538":19,"54":19,"540":[15,19],"542":19,"543":19,"5432":39,"544":19,"545":19,"546":19,"55":[11,17,18,19],"550":19,"551":19,"555":19,"556":19,"557":19,"558":19,"56":[12,19],"560627":18,"563":19,"564":19,"565":19,"566":19,"5678":41,"57":[18,19],"571":19,"575":19,"58":[0,11,17,19],"582":19,"583":19,"587":[19,38],"588":19,"59":[15,17,18,19],"590":19,"591":19,"592":19,"593":19,"595":19,"598":19,"5ec828":19,"5fa9b6":19,"5rndqwluanmdkrqfhkgjsh":10,"6":[0,3,4,14,17,18,20,22,23,30,32,33,38,39,42],"60":19,"600":19,"603":19,"604":19,"607":19,"608":19,"609":19,"60e164d":19,"61":19,"610":19,"612":19,"613":15,"614":19,"616":19,"617":19,"618":19,"62":19,"620":19,"621":[18,19],"622":19,"624":19,"625":19,"626":19,"628":19,"629":19,"63":[18,19],"631":19,"633":19,"634":19,"635":19,"636":19,"637":19,"639":[13,19,20],"64":19,"640":19,"642":19,"645":19,"651":19,"652":19,"655":19,"657":19,"659":19,"66":19,"660":19,"662":19,"664":19,"666":19,"667":19,"668":19,"67":[0,15,17,19],"671":19,"673":19,"674":19,"675":19,"677":19,"678":19,"67822":18,"67837":18,"67842":18,"67858":18,"67863":18,"67884":18,"67896":18,"679":18,"67911":18,"67922":18,"67933":18,"67938":18,"67961":18,"67966":18,"67972":18,"67977":18,"67995":18,"680":19,"68014":18,"68019":18,"68049":18,"68071":18,"68075":18,"6808":18,"68091":18,"68095":18,"682":19,"683":19,"685":19,"688":19,"69":19,"690":19,"691":19,"692":19,"695":19,"696":19,"697":19,"6dxczvmrhkar72shuz9pwd":[0,17],"6e215a":19,"6nvxvayoh9zkr8rmxhu54t":17,"7":[11,18,20,22,23,25,29,30,32,33,34,36,38,39,41,42,45,49],"70":19,"700":19,"701":[15,19],"702":19,"705":19,"707":19,"708":19,"709":19,"71":19,"711":19,"712":19,"713":19,"714":19,"716":19,"717":19,"719":19,"72":19,"720":[0,19],"721":19,"722":19,"725":19,"726":19,"728":19,"729":19,"73":19,"731":19,"732":19,"734":19,"735":19,"736":19,"737":19,"738":19,"7380":18,"739":19,"73ffa44":19,"74":19,"740":19,"745":19,"746":19,"749":19,"75":19,"750":19,"751":19,"752":19,"753":19,"756":19,"757":19,"76":19,"760":19,"762":19,"763":19,"764":19,"7641":15,"765":19,"767":19,"768":19,"769":19,"770":19,"773":19,"774":19,"779":19,"78":15,"780":19,"781":19,"783":19,"787":19,"789":19,"79":19,"792":19,"793":19,"795":19,"7cc3606":19,"7f7a225":19,"7pdujhcvhya4hv29jzqngg":0,"8":[0,11,18,20,22,23,25,29,31,32,33,34,39,41],"80":[19,37],"800":19,"801":19,"802":19,"8025":41,"803":19,"804":19,"805":19,"808":19,"809":19,"81":19,"810":19,"812":19,"813":19,"815":19,"818":19,"819":19,"82":19,"821":19,"822":19,"823":19,"824":19,"826":19,"827":19,"828":19,"83":19,"831":19,"832":19,"833":19,"835":19,"836":19,"837":19,"838":19,"839":19,"84":19,"842":19,"845":19,"849":19,"85":19,"851":19,"853":19,"856":19,"857":19,"858":[11,19],"8588897":6,"859":19,"86":19,"861":19,"862":19,"863":19,"864":19,"864000":9,"865":19,"866":19,"868":19,"87":19,"870":19,"872":19,"873":19,"874":19,"876":19,"877fa0f":19,"878":19,"88":19,"881":19,"882":19,"885":19,"886":19,"887":19,"888":19,"89":19,"893":19,"894":19,"895":[0,17],"897":19,"8aa4cff":19,"9":[0,11,17,18,20,22,23,24,25,28,29,30,31,32,33,34,38,39],"90":19,"900":19,"901":19,"903":19,"904":19,"908":19,"91":19,"910":19,"911":19,"914":19,"915":19,"916":19,"918":19,"919":19,"92":19,"920":19,"924":[0,19],"929":19,"93":19,"930":19,"931":19,"932":19,"933":19,"934":19,"936":19,"937":19,"93706":18,"938":19,"939":19,"94":19,"943":19,"944":19,"947":19,"948":19,"949":19,"95":[15,19],"950":19,"952":19,"954":19,"956":19,"958":19,"96":19,"961":19,"963":19,"967":19,"968":19,"969":19,"97":[0,16,17,19],"970":19,"971":19,"972":19,"975":19,"976":19,"977":19,"97c55d2":19,"98":19,"980":19,"981":19,"981933":18,"982":19,"983":19,"984":19,"985":19,"99":[15,19],"991":19,"992":19,"993":19,"994":19,"995":19,"996":19,"9960":15,"998":19,"9f05417":19,"AS":[0,11,16,17,18],"Avec":27,"C":21,"Ce":[9,19,26,41,44,49],"Ces":[33,44],"Cette":[19,35,37,39,40,44,47],"D":[21,41],"De":[19,33],"Des":[23,27,28,30,33,34,41,48],"Du":19,"EU":19,"Elles":39,"En":[0,1,2,3,4,5,6,8,9,11,12,14,15,16,17,18,19,25,33,35],"Et":19,"Il":[0,18,19,21,22,23,25,28,29,31,33,34,35,37,39,40,41,43,44],"Ils":[22,29],"J":19,"L":[0,14,15,19,21,23,28,29,30,33,38,39,40,41],"La":[0,18,19,20,21,22,23,24,28,29,31,33,34,36,41,43,44,47,48],"Le":[0,4,17,19,21,22,23,24,25,28,30,31,33,38,40,41,42,43,45],"Les":[0,11,17,18,19,21,22,23,25,26,27,28,29,31,33,34,35,36,38,39,41,43,44,45,48],"M":18,"MS":[0,11,16,17,18],"Mais":41,"Mon":[10,16,17,18],"N":19,"Ne":17,"Par":[29,33,38,39,41,42,44,49],"Pas":19,"Pour":[18,19,21,22,25,29,33,35,37,38,40,41,42,43,45,47,49],"S":23,"SA":42,"Ses":23,"Sur":[28,41],"Tue":[4,18],"Un":[0,3,4,9,14,17,19,22,23,25,28,30,33,37,38,39],"Une":[19,20,22,23,28,33,38,40,44,47],"Vous":[19,21,41,44],"Y":[0,15,18,19,20],"_":[0,19],"__main__":39,"_blank":[39,42],"_like_":0,"a":[0,1,2,3,4,5,6,8,9,10,11,12,14,15,16,17,18,19,20,21,22,25,28,33,35,36,37,39,40,42,47],"a012":8,"a11y":19,"a458f5f":19,"aaron":29,"abidjan":0,"ability":19,"able":19,"abon":[0,22,25,28,29,33],"abord":21,"abort":18,"aborted":18,"aborting":18,"about":[2,19,36],"absolu":[39,47],"ac075ec36dc25dcc20c270d2005f0398":18,"acced":[0,3,4,9,14,15,17,23,29,41],"accept":[0,5,12,19,21,22,28,30],"accepted":5,"accepted_policy":0,"accepted_privacy_policy":0,"acces":[0,2,3,4,9,14,17,19,20,29,33,39,40,41],"access":[0,19],"access_token":9,"accessibility":19,"accessibl":[9,19,28,29,41,47],"accord":29,"according":19,"account":[0,1,2,3,4,5,6,8,9,11,12,14,15,16,17,18,19],"account_cre":0,"accra":0,"acteur":41,"actif":[0,4,20,23,25,41],"action":[12,19,21,23,28,33,38,41,44],"action_short_id":0,"action_typ":[0,12,17],"activ":[0,2,3,14,17,19,20,21,22,23,24,27,28,30,33,35,38,39,40,41,43,44],"activat":[17,20],"activit":[18,19],"activity":[19,33],"actualis":[18,19,20,33,47],"actuel":[0,4],"adapt":[23,37,41,44],"add":[19,20,44],"added":[0,4,18,19],"adding":19,"additional":19,"additionnel":[19,28,41],"addresstyp":6,"admin":[2,3,5,8,11,14,15,16,17,18,19,20,41],"admin_contact":2,"administr":[0,2,3,10,14,17,22,25,27,28,29,31,33,34,40,41,48],"administrator":[0,1,3,4,8,14,16,17,18,23],"adress":[0,2,17,20,22,23,30,36,38,39],"aff4d68":19,"affect":[19,22,28,31,33,49],"affich":[0,2,13,18,19,20,22,23,24,25,26,27,28,29,30,31,34,35,39,40,43,44,48],"affichag":[0,19,22,26,28],"affichent":[28,31],"afin":[18,19,21,23,28,29,31,34,36,41,44],"afric":0,"after":[19,37],"again":[0,1,2,3,4,5,6,8,9,10,11,12,14,15,16,17,18],"agit":[18,19,39],"agplv3":19,"agre":0,"aid":[21,35,41],"ains":[19,33,40,44],"air":[21,27,35],"ajout":[0,1,17,18,19,20,21,22,23,25,26,28,29,30,31,34,35,36,38,39,41,42,43,44,45,46,47],"alembic":19,"alert":19,"algier":0,"all":[0,8,15,18,19,21,36,37],"allemand":[19,32,41],"allow":[19,37],"allowed":[0,18],"allur":[11,15,19,22,31,33,34],"alongsid":19,"alor":41,"alphanumer":19,"alphanumeric":0,"alpin":[25,33,44],"already":[0,4,5,12,19,48],"also":19,"altern":19,"altitud":[0,19,20,22],"alway":37,"al\u00e9atoir":[20,42],"amd64":41,"am\u00e9lior":[30,41,44],"an":[0,9,18,19],"analys":[0,18,19,22,33,40],"analysis_visibility":[0,18],"ancien":38,"and":[0,4,14,18,19,20,23,33,36,37,38,41],"android":35,"anglais":[0,13,19,20,21,28,32,41],"annot":19,"ann\u00e9":[15,31],"anonym":41,"anonymous":41,"anoth":4,"antiali":19,"any":19,"anymor":19,"aout":34,"ap":11,"apach":35,"api":[0,1,2,3,4,5,6,8,9,10,11,12,14,15,16,17,18,19,20,21,23,29,33,35,39,40,41,42,45],"api_rate_limit":[19,36,39],"apikey":42,"app":[9,19,29,41,47],"app_log":[19,37,39],"app_port":41,"app_secret_key":[37,39],"app_setting":39,"app_timeout":39,"app_worker":39,"appar":[0,25,26,33,47],"appara\u00eetr":22,"appareil":[19,23,26,33,35],"appartiennent":34,"appeal":[0,1,12,17,18],"appeal_id":12,"appear":19,"appel":[0,1,12,18,19,22,23,28,38],"application_directory":39,"appliqu":[0,1,2,3,4,5,6,8,9,10,11,12,14,15,16,17,18,19,20,21,22,28,29,32,33,35,36,37,39,40,41,44],"apport":19,"approb":[22,28],"approuv":0,"approved":[0,12,17,19],"appui":41,"apr":[10,18],"apres":[0,9,17,19,21,28,29,30,33,38,41,43,44],"architectur":28,"archiv":[0,2,18,19,20,23,33,38,41,43,44],"archive_rgjsr3fhr5yp":0,"archive_rgjsr3fht295ywnqr5yp":0,"archlinux":[41,44],"are":[0,19],"arg":[20,36],"argument":[4,20],"arm":[41,44],"arm64":41,"arnyminerz":19,"array":[0,4,9,18],"arrier":41,"arriv":33,"arrow":19,"arr\u00eat":[0,17,19,22,41,44,45],"asc":[5,8,12,17,18,20],"ascens":33,"ascent":[16,17,18,19],"asset":36,"assign":23,"associ":[0,4,9,14,18,19,20,21,25,27,33,34],"associated":[4,19,20],"assum":19,"assur":[21,29,41],"astridx":[19,33],"async":19,"asynchron":[18,19,23,33],"asynchronous":19,"at":[19,37],"attach":41,"atteindr":33,"atteint":[20,31,33,34],"attend":41,"attendu":42,"attent":[7,18,19,20,37,39,40,41,43,44,47],"attribu":[39,41,42],"attribut":19,"aucun":[0,4,6,8,12,16,17,18,22,23,27,28,33,35,36,43],"augment":47,"aur":19,"aut":44,"auteur":[1,18,28],"auth":[0,1,2,3,4,5,6,8,9,10,11,12,14,15,16,17,18],"auth_token":0,"authentif":[1,7,17,27,29,38],"authentifi":[0,1,5,8,9,11,14,15,16,17,18,24,25,28,33],"authlib":[9,19,29,40],"authoriz":[0,1,2,3,4,5,6,8,9,11,12,14,15,16,17,18,29,41],"authorization_cod":[9,29],"auto":39,"autoespcap":19,"automat":[0,21,22,25,28,41],"autoris":[0,2,9,18,29,40],"autr":[0,19,21,22,23,27,28,35,36,39,41,44],"avail":19,"avanc":[19,32],"avant":[0,19,20,21,23,25,33,41,44,47],"ave_cadent":[16,18],"ave_hr":[16,18],"ave_pac":[16,18],"ave_pow":[16,18],"ave_speed":[16,17,18],"ave_speed_from":18,"ave_speed_to":18,"averag":[15,19],"average_ascent":15,"average_descent":15,"average_dist":15,"average_dur":15,"average_pac":15,"average_speed":15,"avert":[22,23,28,38],"aviron":[25,33],"avoir":[14,21,41,44],"awesom":40,"axe":[18,22],"axis":19,"b":[37,39,42],"b018":10,"b1536fc":19,"b224e17":19,"b29ed7":19,"b748459":19,"b862a77":19,"babel":21,"backend":41,"background":19,"bad":[0,1,2,3,4,5,9,10,12,14,15,17,18],"bas":[19,21,33,36,39,40,41,44,47],"basqu":[19,32],"bateau":25,"bbox":18,"bcc568e":19,"be":[0,2,4,17,18,19,20,23,37],"be26f35":8,"bear":[0,1,2,3,4,5,6,8,9,11,12,14,15,16,17,18],"becaus":19,"been":12,"being":19,"below":37,"bengal":19,"besoin":[37,41],"best_pac":[16,18],"bet":19,"between":19,"bhopmann":19,"bibliothequ":[29,39],"bien":[21,25,41],"bik":[3,4,19],"biking":[14,18],"bin":37,"bio":[0,5,17],"biograph":0,"birn":[19,33],"birth":19,"birth_dat":[0,5,17],"bissau":0,"bjornclauw":19,"black":19,"blacklist":0,"blocag":28,"block":[17,19],"blocked":[0,10,12,17],"blocked_user":0,"bloqu":[0,17,22,23,28],"body":[19,37],"bokm\u00e5l":[19,32],"bon":[37,40],"boolean":[0,2,3,4,8,9,12,13,14,17,18],"boosterl":19,"boratic":19,"bord":[22,23,27,30],"bound":[16,17,18],"bout":21,"bouton":33,"bp":11,"branch":[21,32],"bref":4,"brok":[37,41,43,47],"brows":19,"brut":22,"bug":[21,33],"bugfix":19,"build":[19,21,41],"bulgar":[19,32],"bulgarian":19,"butterflyoffir":19,"button":19,"by":[18,19,37,42],"by_id":9,"by_sport":15,"by_tim":15,"byakurau":19,"b\u00eat":19,"c4asmmbrjsxtirsjtvwewu":18,"c88a515":19,"cach":[19,22,39,47],"cadenc":[19,33],"cairo":0,"calcul":[0,15,19,22,23,31,34,49],"calculated":18,"calendar":19,"calendri":[19,24],"call":19,"callback":[9,29],"calm":33,"calor":[19,31,33],"can":[0,1,12,17,18,19,23,37,47],"cannot":[4,19],"cano":[25,33],"canoeing":19,"can\u00f6":25,"capac":[23,44],"captur":28,"car":[28,33],"caracter":[0,4,9,18,19,29,38,39],"card":19,"cardiaqu":[0,19,22,33],"cart":[0,2,18,19,22,23,27,34,35,39,40,42,48],"cas":[4,9,18,20,21,22,23,25,30,33,38,39],"cass":39,"catalan":[19,32],"cb9d02f":19,"cc":42,"cc3fe1c":19,"cc4287e":19,"cd":[41,44],"cec":19,"cel":[4,19,23,24,25,26,28,33,40],"celui":[19,23,28,40,44],"certain":[19,20,33,35,39,40,41,42],"cf":[19,28,35,36,37,39,41,44,49],"chacun":33,"chain":39,"challeng":[9,29],"champ":19,"chang":[0,4,19,21,22,23,25,28,33,37,38,41,42,44],"changed":19,"changing":19,"chaqu":[22,25],"charact":0,"character":[0,4,19],"charg":[0,9,18,19,20,23,29,43,45,48],"chart":[18,19,40],"chart_dat":18,"chaussur":25,"cha\u00een":[9,21,29],"check":[19,21,41],"check_workout":14,"checkbox":19,"checked":19,"checking":37,"chemin":[39,41,43,47],"chiffr":[27,38],"chines":19,"chinois":[19,32],"chois":[22,41,42],"choos":19,"chown":47,"ci":[19,28],"cibl":21,"city":6,"clair":[21,22],"cleanup":19,"clear":36,"cli":[17,19,20,23,33,38,40,41,47],"click":19,"clickabl":19,"clicking":19,"client":[9,17,19,21,23,28,29,40,41],"client_client_id":9,"client_descript":9,"client_id":[9,29],"client_max_body_siz":[37,47],"client_nam":9,"client_secret":9,"client_ur":9,"cliqu":33,"clon":41,"closing":19,"cl\u00e9":[19,39,40,42,45],"co":[19,21],"cod":[0,1,2,3,4,5,6,8,9,10,11,12,13,14,15,16,17,18,19,20,29,41],"code_challeng":[9,29],"code_challenge_method":[9,29],"code_verifi":9,"codespel":19,"coll":41,"collect":[18,19,33],"color":[0,14,19],"com":[0,2,9,10,12,17,19,29,37,38,41,42,44],"comm":[8,18,19,21,23,27,28,30,31,33,35,41],"command":[19,21,23,30,33,35,36,37,38,39,40,41,43,44,47],"commenc":[0,15,19,21,24,39,47],"commencent":0,"commend":19,"comment":[0,1,12,18,19,28,37,40,41],"comment_id":12,"comment_lik":0,"comment_short_id":1,"comment_suspens":12,"comment_unsuspens":12,"commentair":[0,7,12,23,27,29],"commit":21,"compatibl":[19,21,44],"compil":[21,41],"complet":[19,21,28,41],"completed":0,"complex":21,"compl\u00e9mentair":19,"comport":[33,34,49],"compos":[19,40,41,44,47],"compren":21,"comprend":[19,41],"comprendr":21,"compt":[7,17,18,19,20,21,23,27,28,30,33,38,40,41,46,49],"comradekingu":19,"concern":[12,19,21],"condit":42,"confidential":[0,2,19,30],"config":[2,10,19,36,39,41],"configur":[0,7,18,19,20,22,27,28,29,30,36,37,39,40,42,44,45,47],"configured":19,"confirm":[0,9,19,30,38],"confus":19,"confusedalex":19,"connaiss":[19,23],"connect":[0,28,30,35,41],"connexion":[0,39,41],"conseil":30,"conserv":[35,39,41,42],"consol":[19,39],"consult":30,"contact":[0,1,2,3,4,8,14,16,17,18,23],"contain":[19,41],"container":41,"containing":19,"conten":[19,21,22,30,33,38,39,44],"conteneur":39,"content":[0,1,2,3,4,5,6,8,9,10,11,12,14,15,16,17,18,19],"contenu":[1,12,23,28],"contenus":[28,33],"context":19,"contiennent":21,"contient":[19,21,33,38],"continu":[21,41],"contr":29,"contrair":[18,33],"contribu":35,"contributeur":[19,40,41,46],"contributing":19,"contributor":[2,39,42],"control":[19,37],"contr\u00f4l":[2,33],"convert":33,"coordinat":[6,18],"coordon":[6,18,33,39],"copi":41,"copy":[2,39,42],"copyright":[2,39,42],"cor":19,"corp":29,"correct":33,"correctly":19,"correspond":[0,18,19,33,37,40,45,48],"correspondr":[18,23],"could":19,"couleur":[0,22,33],"count":[10,18],"cour":[18,19,20,21,24,35,41],"courriel":[0,17,19,21,23,28,30,39,40,41,44,47],"cours":[15,19,22,25,33],"court":[1,4,8,18],"coverag":19,"cp":44,"creat":[19,41,44],"create_app":37,"created":[0,1,4,9,12,18],"created_at":[0,1,5,8,10,12,17,18],"creation":19,"creation_dat":[4,16,17,18],"creativecommon":42,"credential":0,"criter":[12,17],"criteri":18,"critical":47,"croat":[19,32],"croatian":19,"cross":[9,29],"crossing":[33,45],"cr\u00e9":[0,1,4,9,12,18,19,20,21,22,25,28,29,30,33,38,39,41,44,48],"cr\u00e9ation":[0,19,22,28,30],"csrf":[9,29],"current":[0,17,19],"current_pag":18,"custom":39,"cycling":[14,18,19],"czech":19,"c\u00f4t":[21,23,28],"d46ba03":19,"d743abf":19,"d81afd5":19,"dan":[0,2,4,18,19,20,21,22,23,24,25,26,27,28,29,30,31,32,33,34,35,36,37,38,39,40,41,42,43,44,45,48],"danielsiersleben":19,"dark":19,"darksky":[19,33,45],"dashboard":19,"dat":[0,1,2,3,4,5,6,9,11,14,15,16,17,18,19,20,22,26,33,34,47],"databas":[19,20,41],"database_disable_pooling":39,"database_url":[37,39,47],"date_format":0,"date_string":0,"datetim":19,"david":19,"davidhenrythoreau":19,"day":[15,19,20,36],"db":[19,21,41,44],"dd":0,"ddl":19,"debian":[41,46],"debug":41,"debugging":41,"dec":[0,1,5,8,10,12,17,18],"decr":[21,44],"default":[15,18,19,37],"default_equipment_id":0,"default_for_sport_id":4,"default_staticmap":[19,39],"definit":19,"del":[33,47],"delet":[0,1,4,9,17,18,19],"deleted":19,"deleting":19,"demand":[0,7,12,17,19,20,23,29,38,40],"dep":26,"depending":[0,18,19],"deployment":19,"deprecated":[0,19,20],"depuis":[20,38,39,41,42,45],"derni":[13,17,19,28,41,44],"derri":29,"desc":[5,8,12,17,18,20],"descent":[16,17,18,19,33],"descript":[4,9,13,16,17,18,19,20,21,25,28,33,34,37],"dessous":19,"detail":[0,19,36],"detailed":19,"detect":19,"detected":19,"deux":[13,19,20,23],"dev":[19,21,40,41,44],"devcontain":[19,41],"development":19,"devic":19,"devr":44,"diagnostic":36,"dialect":47,"differ":[32,33],"different":[17,19],"diff\u00e9rent":[19,22,28,33,40,44],"dimanch":[15,24],"direct":[19,33,39,47],"directory":[19,37],"disabl":19,"disabled":0,"discours":23,"discrepancy":19,"discut":21,"display":[0,19,23],"display_ascent":0,"display_nam":6,"displayed":[0,19],"displaying":19,"disponibl":[0,11,20,21,22,23,25,28,29,30,32,36,38,40,41,43,45,46],"dispos":[0,23,33],"distanc":[0,11,16,17,18,19,22,25,31,33,34],"distance_from":18,"distance_to":18,"dkm":19,"do":[0,1,2,3,4,5,6,8,9,10,11,12,13,14,15,16,17,18,19,48],"dock":[19,40,47],"dockerfil":19,"dockerhub":41,"docsrc":21,"docu":19,"document":[21,29,35,36,37,39,40,41,44,47],"doesn":19,"doit":[0,2,4,9,14,18,19,21,23,29,30,38,39,41,44,47],"doiv":25,"doivent":[18,19,21,29,36,38,41,43,44],"domain":[18,39,42],"don":[0,9,10,15,17,18,19,21,22,23,29,31,35,38,39,40,41,43,44,47],"donc":21,"dont":[17,29,30,33],"dor\u00e9nav":19,"dotenv":19,"dotlambd":19,"doubl":18,"down":[19,41],"downgrad":19,"download":[0,18,19],"dperruso":19,"dramatiq":[19,20,37,38,39,40,41,43,44,47],"dramatiq_log":[19,39,41,43],"dramatiq_log_file_path":37,"droit":[0,14,17,19,23,28,29,41],"drop":19,"dropdown":19,"dupliqu":21,"dur":[11,18,19,25,31,33,34,43],"durat":[16,17,18,19],"duration_from":18,"duration_to":18,"during":[0,1,4,12,18],"dutch":19,"d\u00e9":[3,17],"d\u00e9bloqu":17,"d\u00e9bogag":41,"d\u00e9bogueur":41,"d\u00e9but":[15,18,20],"d\u00e9clench":33,"d\u00e9connexion":0,"d\u00e9conseil":21,"d\u00e9couvert":28,"d\u00e9criv":12,"d\u00e9crivent":41,"d\u00e9fault":[28,33,38,42],"d\u00e9faut":[0,1,4,5,8,9,12,13,16,17,18,19,20,22,23,25,27,28,33,36,39,42,43,49],"d\u00e9fin":[4,19,20,22,23,25,29,33,36,39,40,43,47],"d\u00e9j\u00e0":[18,20,21],"d\u00e9livr":9,"d\u00e9marr":[19,21,36,37,41,43,44,48],"d\u00e9marrag":39,"d\u00e9mont":41,"d\u00e9nivel":[0,11,18,22,31,33,34],"d\u00e9pannag":35,"d\u00e9part":[18,22,33],"d\u00e9pass":[20,23,33],"d\u00e9pend":[19,41,44],"d\u00e9plac":[19,33],"d\u00e9ploi":[39,40,41],"d\u00e9p\u00f4t":[41,44,47],"d\u00e9roul":[25,34],"d\u00e9sactiv":[0,17,19,20,22,23,25,28,33,36,38,39,40,41,44,49],"d\u00e9sorm":19,"d\u00e9tail":[0,19,22,25,27,33,48],"d\u00e9taill":[37,40],"d\u00e9tect":30,"d\u00e9velopp":[19,20,21,32,35,39,40],"e":[0,22,40],"e2e":[19,21],"e63433a1d62":19,"e8e7d1f":19,"e8f7":10,"ea0ac99":19,"easytigrrr":19,"eau":[25,33],"edc677":19,"edge":19,"edit":[0,19],"editing":19,"effect":19,"effectu":[19,21,23,43,44],"elev":[0,18,19,20,33],"elevation_data_sourc":18,"elevation_servic":2,"elles":[18,19],"email":[0,2,10,12,17,19,20,21,41,43,47],"email_to_confirm":0,"email_url":[37,38,39,41,47],"emploi":41,"empty":19,"emp\u00each":[20,29],"enable_geospatial_featur":[19,39,44],"encod":38,"encoded":19,"encor":[19,21,35,41,44],"endpoint":19,"enfin":19,"enfreint":[28,33],"engin":41,"english":19,"enlev":4,"enregistr":[0,20,29,30,32,33],"ensembl":[34,44],"ensuit":[29,41],"enter":19,"entered":18,"enti":9,"entier":21,"entity":[0,18],"entra\u00een":[19,23,25,26],"entre":[4,9,22,29,33,41],"entrer":33,"entry":19,"entr\u00e9":[17,18,19,23,29,39],"enumerat":36,"env":[19,39,41,44],"environ":[19,20,21,23,40,42,43,45,47],"environment":[19,37,47],"envoi":[0,17,19,23,28,29,30,33,38,39,40,41,43,44],"epifanov":19,"equal":2,"equipment":[0,3,4,16,17,18,19,29],"equipment_id":[0,18],"equipment_short_id":4,"equipment_typ":[3,4],"equipment_type_id":[3,4],"equipment_type_label":4,"equivalent":19,"erral":19,"erreur":[0,9,18,19,20,22,23,26,33,41,44,48,49],"erron":33,"error":[0,1,2,3,4,5,6,8,12,14,16,17,18,19,37,48],"errored":0,"errored_fil":18,"errored_workout":18,"espac":29,"espagnol":[19,32],"esprit":[28,33],"estim":[19,40],"etc":41,"ets":[20,33],"europ":[0,20],"event":19,"ewm":19,"exampl":[0,2,9,10,12,17,19,29,37,38,41],"exc":47,"exced":2,"exceed":[0,4,18,19],"exceeding":19,"except":[33,47],"exclu":[22,33,49],"exclur":22,"exclus":33,"exec":[41,44],"execstart":37,"exempl":[0,1,2,3,4,5,6,8,9,10,11,12,13,14,15,16,17,18,21,23,28,29,33,35,36,37,38,39,41,42,43,44,47],"exhaust":35,"exist":[0,4,5,13,15,17,18,19,21,23,25,28,31,34,35,41,44,48],"existent":[8,12,17,20],"exit":[20,36],"expected":12,"expecting":18,"expir":20,"expired":[0,1,2,3,4,5,6,8,9,10,11,12,14,15,16,17,18],"expires_at":9,"expires_in":9,"expliqu":[0,12],"expliquent":12,"exploit":[28,33,37,40,41,44],"explor":19,"export":[0,19,20,22,23,35,36,38,40,41,43],"exporting":19,"exp\u00e9diteur":39,"extens":[0,18,19,20,33,36,41,44,47],"extra_host":41,"extract":[19,21,33],"extrair":21,"extr\u00eam":[22,33,49],"ext\u00e9rieur":[19,25,33],"ex\u00e9cu":[19,20,21,33,39,43],"ex\u00e9cut":[19,20,21,37,41,43,44],"ex\u00e9cutent":[21,43],"f2aec30":19,"f5":41,"f96dcef":19,"fa33f4d996844a5c73ecd1ae24456ab8":18,"facil":21,"facilit":[19,44],"facult":[4,29],"faibl":21,"fail":19,"failed":48,"faill":21,"fair":[0,1,18,19,22,23,44],"fait":[18,19,28,40],"fals":[0,1,2,3,5,8,9,10,12,13,14,16,17,18,39],"falsif":[9,29],"famill":0,"farthest":19,"fa\u00e7on":2,"fb10602":19,"fbdad3f":19,"fd":[0,11,16,17,18],"featur":[18,19],"featurecollect":18,"feed":19,"ferm":21,"ff38d0c":19,"fichi":[0,2,18,19,20,21,22,23,27,35,37,39,40,41,43,44,46,48],"field":19,"fil":[0,2,18,19,37,39,40,41,43,44,47],"file_limit_import":2,"file_nam":0,"file_siz":[0,10],"file_sync_limit_import":2,"files_count":[10,18],"filt":[19,34],"filter":19,"filtered":[19,23],"filtering":19,"filtr":[0,12,18,19,23,26,27,34],"fin":[15,18,19,20,33,36,41],"finish":19,"finnish":19,"first":[4,19],"first_nam":[0,5,17],"fit":[0,18,19,20,22,33,40,46],"fitdecod":[19,40],"fitotrack":35,"fittracke":[4,9,18,20,22,23,27,28,29,32,33,36,37,38,39,40,41,43,44,45,46,48],"fittrackee_client":[21,41],"fittrackee_database_nam":44,"fittrackee_domain":28,"fittrackee_email":43,"fittrackee_host":29,"fittrackee_install":46,"fittrackee_users_export":43,"fittrackee_worker":37,"fittrackee_workout":43,"fix":[19,36],"fixed":19,"flake8":19,"flask":[19,36,39,40,41,43,47],"flask_app":[37,39],"flaticon":[33,40],"flatwat":19,"flech":33,"float":[0,18,19],"flow":29,"flux":[7,19,21,24,28],"fmstrat":19,"fois":[22,33,44],"follow":[0,5,8,10,12,17,19,29],"follow_request":[0,5,8],"follow_request_approved":0,"follower":[0,1,5,8,10,12,17,18,19],"followers_only":[0,1,4,17,18],"following":[0,1,5,8,10,12,17,18,19],"fonction":[11,21,22,23,28,29,33,38,41],"fonctionnal":[33,35,39,41,44],"fonctionnalit":44,"fonctionnent":41,"fond":42,"foot":19,"for":[0,2,4,6,14,17,18,19,36,37],"forbidden":[0,1,2,3,4,5,6,8,9,10,11,12,14,15,16,17,18],"forc":[4,40],"forgery":[9,29],"fork":40,"form":[0,9,18,19],"format":[0,15,18,19,20,21,22,35],"formulair":33,"fort":[21,39,41],"forward":41,"forwarded":[29,37],"found":[0,1,3,4,5,8,9,12,13,14,15,17,18,19],"fourn":[0,4,9,13,15,18,19,20,29,30,33,36,38,45,47],"fournisseur":[18,19,20,23,33,39,40,42,45],"fr":[0,13,28,42],"fram":19,"franc":[6,21,32,39,42],"frankzimp":19,"freepik":[33,40],"french":19,"fri":18,"from":[4,5,6,8,15,18,19,20,37],"fr\u00e9quenc":[0,19,22,33],"fr\u00e9quent":41,"ft":19,"ftcli":[19,41,44],"fuch":19,"full":19,"fullchain":37,"fullscreen":19,"furo":19,"fuseau":[0,18,20,22,30],"fusion":21,"futur":[0,44],"gadgetbridg":35,"galician":19,"galicien":[19,32],"gallegonovato":19,"galsh":19,"gap":19,"gard":[18,28,33,39,44],"garmin":[19,33,46],"gateway":41,"gcc":[40,41,44],"gdal":[40,44],"generat":19,"generated":18,"generating":18,"geoalchemy2":40,"geocod":[6,29],"geocoding":[7,29],"geojson":18,"geometr":39,"geometry":[18,19,20,44,48],"geopand":40,"ger":[12,19,20,23,36,37,38,40,47],"german":19,"gestion":[19,21,37,38,39,41,42,44],"get":[0,1,2,3,4,5,6,8,9,10,11,12,13,14,15,16,17,18,19],"getting":[2,6,19],"gif":0,"git":[41,44],"github":[19,21,41,44],"gl":0,"glggr":19,"global":[18,19,23,27],"global_map_workouts_lim":2,"gmt":[0,1,4,5,8,9,10,11,12,16,17,18],"gnu":19,"gon":18,"gorgoback":19,"gp":[18,19,22,33,49],"gpl":35,"gpx":[0,9,18,19,20,21,22,33,35,40,46],"gpxpy":[0,19,33,40],"grammar":19,"grand":[0,19,20,21,26,33],"grant_typ":9,"graph":[19,22,24,33],"graphiqu":[0,19,22,40,44,48],"gray":19,"great":[1,2,18,19],"gr\u00e2c":[40,41,46],"guid":41,"guillemet":18,"gunicorn":[19,37,39,40,47],"gz":[41,44],"gzip":0,"g\u00e9ner":[9,19,20,22,27,29,33,39,40,41,42,44,48],"g\u00e9n\u00e9ral":40,"g\u00e9ometr":[18,44,47],"g\u00e9ospatial":[19,39,44],"h":[18,33,43],"ha":[0,11,16,17,18],"halfbik":[19,25,33],"han":19,"handl":19,"handling":19,"hantangantan":19,"has":[1,4,12,17,18,19],"has_equipment":3,"has_next":[0,5,8,9,10,12,17,18],"has_prev":[0,5,8,9,10,12,17,18],"has_workout":14,"haut":43,"hav":[0,1,2,3,4,5,6,8,9,10,11,12,14,15,16,17,18,19],"hawolex":19,"heart":19,"heartrat":19,"heat":[33,40],"heatmap":40,"help":[20,36],"heur":[19,22,33,45],"hexadecimal":0,"hexad\u00e9cimal":0,"hgzyfxgvwkcepdq3vyk67q":18,"hid":19,"hidden":19,"hide_profile_in_users_directory":0,"hiding":19,"high":19,"hiking":[0,14],"his":19,"histor":[35,45],"hom":37,"horair":[0,18,20,22,30],"host":[37,39,41],"host_app_port":[39,41],"host_database_d":39,"host_log_d":39,"host_redis_d":39,"host_staticmap_cache_d":[19,39],"host_upload_d":39,"hosted":19,"hour":36,"hoverlin":19,"how":37,"hr":19,"hr_visibility":0,"href":[2,39,42],"html":19,"http":[0,1,2,3,4,5,6,8,9,10,11,12,13,14,15,16,17,18,28,29,37,39,41,42,44],"http2":37,"hub":19,"hv9kwvdtbhhyfvml7phovq":12,"hvybqybra7wwxpastwr4v2":[0,11,16,17],"h\u00e9berg":[21,39,40,41],"h\u00f4t":[39,41],"i18n":[19,21],"icon":19,"ic\u00f4n":[33,40],"id":[0,1,3,4,6,8,9,10,11,12,14,16,17,18,19,20,33],"ide":21,"identif":38,"identifi":[0,1,6,8,9,12,14,15,18,20,29,33],"id\u00e9al":21,"if":[19,37,41,44],"iggydev":19,"ignor":33,"ildav":19,"imag":[0,17,18,19,22,27,33,39,40,41,42,44,48],"imm\u00e9diat":41,"impact":[19,23,28,33],"imperial":19,"imperial_unit":[0,13,28],"impl":19,"implementing":19,"impliqu":21,"impl\u00e9ment":[21,44],"import":[4,9,19,20,21,22,33,37,39],"importing":19,"improv":19,"improved":19,"imp\u00e9rial":[0,13,22,28,33],"in":[0,1,2,3,4,5,6,8,9,10,11,12,14,15,16,17,18,19,41],"in_progress":[0,18],"inact":[0,4,17,18,30,41],"inchang":23,"including":19,"inclus":19,"inclut":[19,41],"inconsistency":19,"inconsistent":19,"incorrect":[4,19,21,25],"increas":19,"index":18,"indiqu":[21,33,39],"indiquent":41,"ind\u00e9fin":43,"ind\u00e9sir":28,"info":[19,39],"infobull":33,"inform":[0,2,17,19,22,23,35,37,38,39,41],"inf\u00e9rieur":[19,21,44],"init":19,"initial":[19,21,44],"initialis":[19,21,39,41,42,45],"initializ":19,"input":19,"inscript":[0,2,19,23,27,28,38,40],"inscrir":[2,19,27,30,41],"insensibl":39,"instabl":[35,41],"install":[19,35,37,39,44,47],"instanc":[2,19,22,23,28,33,36,37,38,39,43],"instant":[21,22],"instead":19,"instruct":[0,19,21,30,38,47],"int":[0,3,4,9,12,14,18],"integ":[0,1,2,3,4,5,8,9,12,14,15,16,17,18,20],"integer":4,"integr":[21,41],"interact":[21,27],"interag":[19,27,29],"interceptor":19,"interfac":[0,18,19,22,23,28,30,33,35,36,37,38,39,40,41,43,44,47],"internal":[0,1,2,3,4,5,6,8,12,14,16,17,18,41],"interrompr":[18,22],"interrompu":[20,33,45],"interrompus":33,"into":19,"introduit":[19,44],"int\u00e9rag":40,"int\u00e9rieur":41,"int\u00e9r\u00eat":21,"inutil":21,"invalid":[0,1,2,3,4,5,6,8,9,10,11,12,14,15,16,17,18,19,38,39],"invalidat":19,"invalidemailurlschem":47,"invers":41,"invit":41,"ip":[36,37],"is":[0,1,2,3,4,5,6,8,9,11,12,14,15,16,17,18,19,20],"is_act":[0,3,4,10,12,14,17],"is_active_for_us":14,"is_email_sending_enabled":2,"is_followed_by":[0,8,10,12,17],"is_registration_enabled":2,"is_reported_user_warned":12,"iso":[13,20],"isort":19,"issu":19,"issued_at":9,"it":[0,4,19],"italian":19,"italien":[19,32],"jan":[16,17,18],"jat255":19,"javascript":[19,21,41],"jcminarro":19,"jderuit":19,"jeir6cdcadx8bz6zeqssnr":18,"jeroened":19,"jeton":[0,1,2,3,4,5,6,8,9,11,12,14,15,16,17,18,20,29,39],"jinj":19,"jktd4tpqdgapwntsjjpdvh":18,"jmlich":19,"job":19,"john_do":17,"johndo":17,"jour":[0,1,2,4,8,14,15,17,18,19,20,21,22,23,25,31,33,39,40,41,47],"journal":[19,37,44,47],"jpeg":17,"jpg":0,"js":[18,40],"json":[0,1,2,3,4,5,6,8,9,10,11,12,14,15,16,17,18,22],"juanro49":19,"jul":[0,11,16,17,18],"july":9,"jusqu":[24,39,44],"jwt":39,"j\u0119drzejczak":19,"kabyl":[19,32],"kayak":[25,33],"kayak_boat":3,"kayaking":19,"kcj6hdgqqpkaakqmfqj8jv":17,"kd5wyhwltvozw6o3au5m4j":18,"keep":19,"key":36,"keyboard":19,"kjxavsturjvoah2wvcegef":[16,17,18],"km":[18,33],"kml":[18,19,20,33],"kmorincl":19,"kmz":[18,19,20,33],"koen":19,"label":[3,4,14,19,25],"laiss":38,"lanc":[19,23,38,39,41,43],"lang":[0,13,19,20,21,28],"langu":[0,13,19,20,21,22,28,30,32],"languag":[0,6,19],"lap":18,"laquel":[21,25],"larg":[0,18,19,37],"las":33,"last":19,"last_nam":[0,5,17],"latitud":18,"lavoi":19,"layout":19,"lc_messag":21,"ld":[0,11,16,17,18],"leafcompost":19,"leaflet":[18,40],"lectur":[8,29],"left":19,"legal":42,"legitimat":19,"lemetist":19,"leo":19,"lequel":[0,44],"lesquel":21,"less":[2,19],"lettr":[13,20],"lev":[28,38],"level":19,"li":[12,19,23,33,49],"libgdal":[40,41,44],"libr":33,"librair":[9,28,39,44],"library":19,"licenc":42,"licens":[19,35,42],"lien":[19,39],"lieu":[0,19,33],"lign":[19,23,30,33,35,36,37,38,39,40,41,43,44,47],"lik":[1,18,19,27,33],"liked":[1,17,18],"likes_count":[1,17,18],"lim":[19,37],"limit":[4,18,19,20,23,28,31,33,34,39,40,41,43],"limit_exceeded":18,"lin":[20,37],"linestring":18,"linguist":21,"link":19,"lint":[21,41],"linux":41,"lir":[19,40],"liss":22,"list":[0,1,9,18,19,20,22,23,25,27,28,33,35,42,43],"listen":37,"ll":37,"llm":21,"load":[19,47],"loading":19,"local":[0,19,21,35,39,41,44],"localhost":[19,39,41],"localis":[0,6,18,21,34,39,44],"localiz":19,"locat":[0,5,6,17,19,37],"log":[0,1,2,3,4,5,6,8,9,10,11,12,14,15,16,17,18,19,20,37,39,41,43,47],"log_d":47,"log_level":[19,39],"logfil":37,"logged":0,"logging":19,"login":[0,19],"logo":40,"logout":[0,19],"long":19,"longitud":18,"longtemp":41,"longu":[4,11,19,31,33,34,39],"longueur":18,"lookup":6,"lor":[0,19,20,21,22,23,25,28,33,48],"lordsexy":19,"lorsqu":[0,19,20,31,33,34,38,41,47],"lu":[8,28],"lukasitaly":19,"lund":[0,15,24],"machin":41,"macos":[19,41],"mail":[22,40],"mailhog":41,"mainten":[19,36,39,44],"majeur":[19,21,44],"major":33,"majuscul":18,"mak":[19,21,41,44],"makefil":[39,41],"malformed":[0,19],"manag":[19,20,23],"mani":42,"manipul":40,"manqu":[19,20,22,33],"manual":0,"manually_approves_follower":0,"manuel":[21,22,28,41,49],"manufactur":19,"map":[16,17,18,19,27,33,35,39,40,47],"map_attribu":[2,37,39,42],"map_id":18,"map_til":18,"map_visibility":[0,17,18],"mappag":41,"mapping":19,"mar":[0,4,17,18,19,45],"mara21":19,"march":[15,19,22,25,33],"margin":19,"mariusz":19,"mariuz":19,"mark":[8,19],"markdown":[19,23,28,33],"marked_as_read":8,"marker":19,"marqu":[8,23,28],"masqu":[17,22,26,28],"match":0,"matching":19,"max":[2,5,17,18,19,20,33,34],"max_alt":[16,17,18],"max_cadent":[16,18],"max_hr":[16,18],"max_pow":[16,18],"max_single_file_siz":2,"max_speed":[16,17,18],"max_speed_from":18,"max_speed_to":18,"max_user":2,"max_zip_file_siz":2,"maximal":[2,11,18,19,20,22,23,33,34,48],"maximum":[2,23,40],"may":19,"mbw83":19,"md":19,"measur":19,"medformatik":19,"meilleur":[11,29,33,34],"mensuel":[19,24],"mention":[0,1,8,28,39,42],"menu":19,"merc":[19,21],"messag":[0,2,5,9,17,18,19,20,21,23,26,29,30,36],"message_id":10,"messages_preferent":0,"mesur":19,"met":[18,21,44],"method":[0,18,19],"mettr":[1,2,8,17,18,19,20,21,22,23,40,41,47],"mi":19,"microsecond":19,"middlewar":41,"migrat":[19,20,21,41,44],"migration_messag":21,"min":[19,33],"min_alt":[16,17,18],"minim":33,"minimal":[18,19,22,29,41],"minimum":[0,2,3,10,12,14,15,17],"minor":19,"minuscul":18,"minut":[36,43],"mis":[0,4,14,17,18,19,20,21,23,25,29,33,39,40,41,47],"missing":[0,18,19,20,44],"missing_elevations_processing":0,"mm":0,"mmm":0,"mmy3qpl3vcfukjgffbncjv":0,"mo":23,"mobil":[19,24,35],"mod":[19,33,41],"modal":[19,26],"model":[19,21],"moder":[12,15,17,19,33,38],"moderator":[12,17,19,20,23],"modif":[0,21,22,35,41],"modifi":[0,3,4,12,14,20,22,23,24,25,26,28,29,30,31,33,34,36,37,38,39,41,42,43,45,49],"modification_dat":[1,16,17,18],"modify":19,"modul":[19,39],"moin":[4,6,8,12,16,18,21],"mois":[15,19,24,31],"moment":[0,18,19,21,25,33,41,43,45,49],"mond":[25,28,33],"mondstern":19,"mono":19,"month":[15,19],"monthly":19,"montr":35,"mor":[18,19],"morning":18,"mot":[0,17,20,22,23,30,38,39,40],"mountain":14,"mountaineering":19,"mous":19,"mov":19,"moving":[16,17,18,19],"moyen":[11,15,18,19,22,31,33,34,37,43],"mrab":19,"mult":37,"multilinestring":18,"multipart":[0,9,18],"multipl":[19,36],"multitrack":33,"must":[0,2,4,17,18,19,20],"mv":41,"my":4,"mzydicyyfktg3gga2x8afu":1,"m\u00e9thod":[9,29,33,37,39],"m\u00e9triqu":[13,22,28,33],"m\u00e9tropolitain":6,"m\u00e9t\u00e9o":[18,19,20,23,33,39,40],"m\u00e9t\u00e9orolog":33,"m\u00eam":[19,23,25,28,33,34,36,41,44],"nag":33,"naissanc":0,"nam":[6,9,19],"named":41,"nano":[41,44],"navig":[0,19,22,23,26,30,41],"nb":0,"nb_sport":[0,5,17],"nb_workout":[0,1,5,8,10,12,17,18],"nbsp":42,"nederland":19,"need":37,"net":41,"netinstall":46,"nettoi":19,"network":37,"new":[0,4,17,19,20],"new_email":17,"new_password":0,"next":19,"next_workout":[16,17,18],"nginx":[19,23,29,36,37,47],"ni":[28,33],"nic":1,"nikit":19,"niveau":[1,4,19,23,27,28,39,44],"nixos":40,"nl":0,"no":[0,1,4,9,17,18,19],"no_gpx":18,"nod":[19,40,41],"nofollow":42,"noir":20,"nom":[0,5,9,12,15,17,19,20,28,30,33,39,45],"nombr":[0,2,5,17,18,20,23,25,26,31,33,34,39,40,43,44],"nombreux":21,"nomenclatur":19,"nominatim":[6,19,39],"nominatim_url":[19,39],"nomm":41,"non":[0,3,4,8,9,12,14,15,18,19,20,21,23,25,28,33,35,39,44,48],"noopen":[39,42],"noreferr":39,"norv\u00e9gien":[19,32],"norwegian":19,"nosuchmoduleerror":47,"not":[0,1,2,3,4,5,6,8,9,10,11,12,13,14,15,16,17,18,19,21,34,41,44,45,48],"notat":36,"notif":[0,7,19,29,33,38],"notification_id":8,"notification_preferent":0,"notification_typ":8,"nouveau":[0,19,20,21,32,33,41],"nouvel":[0,4,17,20,21,30,33,38,41,44],"nov":[1,18],"now":20,"null":[0,1,2,4,5,8,10,12,14,15,16,17,18,19],"numb":[2,19,37],"num\u00e9ro":21,"nuv9cy8vqonrqkhtz5pqaq2zw7msh0mornpjr14amswd6f6":9,"n\u00e9cessair":[18,21,23,38,39,40,41,42,44,47],"n\u00e9cessit":[19,21,29,39,41,42,44],"n\u00e9cessitent":[21,29,39,42],"n\u00e9erland":[19,32],"n\u00e9gat":[18,31,33,34],"o22a27s2abpuoxjbxv3ujdox":9,"oauth":[0,1,2,3,4,5,6,8,9,11,12,14,15,16,17,18,19,27,40],"oauth2":[7,29],"oauthlib":29,"object_id":12,"object_typ":12,"objet":[0,1,2,3,4,8,12,14,17,18],"obligatoir":[4,9,12,15,18,19,20,29,39,40],"obten":[0,1,2,3,4,5,8,9,10,11,12,14,15,16,17,18,29,39],"octet":0,"of":[0,2,4,18,19,23,29,37],"office365":38,"officiel":[41,44],"offre":41,"offset":19,"ok":[0,1,2,3,4,5,6,8,9,10,11,12,13,14,15,16,17,18],"oliverpiffer":19,"omis":38,"once":[0,1,18],"ondrejzivny":19,"one":[0,18,19],"onglet":29,"ongoing":[0,18],"only":[0,1,18,19],"only_manual":0,"open":[19,27,35],"open_elev":[0,2,18],"open_elevation_api_url":[19,39],"open_elevation_smooth":[0,18],"openelev":[19,22,39],"openstreetmap":[2,19,33,39,42],"opentrack":35,"optimal":33,"option":[19,20,31,33,36,44],"optionnel":[4,8,9,40],"op\u00e9rationnel":41,"or":[0,1,2,3,4,8,14,16,17,18,19],"order":[5,8,12,17,18,19,20],"order_by":[12,17,18],"ordre":[5,8,12,17,18,20],"org":[2,39,42],"origin":[0,33],"original":[18,19,33],"osm":[6,39,42],"osm_id":6,"osmfr":42,"other":[0,4,17,19],"out":[0,19],"outdoor":[19,42],"outil":[21,33,35,41],"ouvert":21,"ouvr":[21,41],"over":19,"overlap":19,"overlay":19,"own":12,"owner":[17,19,20,41],"o\u00f9":[4,20,23,30,42],"p":19,"pac":[0,14,19],"pace_and_speed":0,"pace_speed_display":[0,14],"pacific":0,"packag":19,"packaged":19,"paddl":[25,33],"paddleboarding":19,"padel":[19,25,33],"paf38":19,"pag":[0,1,5,8,9,10,12,16,17,18,19,20,23,27,33,34,44],"pagin":[0,1,5,8,9,10,12,16,17,18,20],"palet":41,"pand":19,"paquet":[19,40,41,44],"par_pag":17,"paragliding":19,"paragraph":44,"paralleliz":19,"paramet":[4,37],"parameter":[4,19],"parametr":[0,1,3,4,5,6,8,9,12,13,14,15,16,17,18,19,23,28,29],"parapent":33,"pareck":29,"paris":[0,6,20],"parm":[19,45],"pars":19,"parsing":18,"part":[0,6,18,19,21,29,30,33,35,39,40,46,48],"particuli":[21,33],"partiel":19,"parvient":41,"pass":[0,17,20,22,23,30,37,38,39,40],"passerel":41,"password":[0,19,20,38,41],"passwordwith":38,"patch":[0,1,2,3,4,8,12,14,17,18],"paus":[16,17,18,19,22,33],"payload":[0,1,2,3,9,12,14,17,18],"pem":37,"pend":33,"pending":8,"per":[19,20,33,36,44],"per_pag":[5,17,18],"perform":[23,31,34,41,44],"period":15,"perm":[0,1,2,3,4,5,6,8,9,10,11,12,14,15,16,17,18],"permet":[4,19,20,23,27,29,30,33,35,39,43,44,47],"permettent":[15,33],"permettr":[19,29],"personnalis":[19,23],"personnel":[33,34],"petit":19,"peut":[0,1,3,4,9,14,15,17,18,19,20,21,22,23,24,25,26,28,29,30,31,32,33,34,36,37,38,40,42,44,49],"peuvent":[0,19,21,22,23,25,26,27,28,30,33,34,35,38,39,40,41,44],"pg_dump":44,"pi":21,"pictur":[0,1,5,8,10,12,17,18,19],"piec":4,"pied":[15,19,33],"pil":19,"ping":2,"pip":[41,44],"pipenv":19,"pkce":[9,29],"plac":[33,41],"placemark":33,"plan":41,"planch":[25,33],"plateform":[21,41,44],"pleas":[0,1,2,3,4,5,6,8,9,10,11,12,14,15,16,17,18,19],"plein":[21,27,33,35],"plugin":47,"pluj":19,"plupart":29,"plus":[4,11,19,20,21,23,25,30,31,33,34,35,37,39,41,42,44,47],"plusieur":[0,19,23,27,33,34,35,37,41],"png":[0,18,39,42],"po":21,"poesty":19,"poetry":[19,40,41],"point":[0,2,3,4,9,14,17,18,19,21,22,29,33,36,39,41,49],"policy":[0,19],"polish":19,"polit":[0,2,19,30],"polon":[19,32],"pong":2,"pooling":39,"port":[19,38,39,41],"portug":[19,32],"portugues":19,"posit":[18,19,22,31,33,34],"possibil":42,"possibl":[19,20,21,22,23,25,28,33,35,38,40,41,43,49],"post":[0,1,4,5,8,9,12,17,18,29],"post_start":47,"postg":[19,21,40,41,44,47],"postgr":[19,44,47],"postgres_db":39,"postgres_password":39,"postgres_us":39,"postgresql":[19,21,37,39,40,41,44,47],"postgresql10":19,"postgresql12":19,"postgresql13":19,"postgresqlimpl":19,"pot":21,"pourquoi":12,"pourr":[19,36],"pouv":[19,21,22,33,41,44,49],"pouvoir":36,"pow":19,"pr":[19,21],"pratiqu":[37,40],"preferent":[0,19],"preferred":6,"premi":[22,44],"prend":19,"prendr":[19,21,23],"prepar":19,"present":19,"prevent":[19,37],"previous":19,"previous_workout":[16,17,18],"priorit":43,"pris":[0,9,19,20,28,29,33,45],"priv":[19,25,28,33],"privacy":[0,19],"privacy_policy":2,"privacy_policy_dat":2,"privat":[0,1,4,17,18],"privileg":41,"privkey":37,"problem":[19,31,34,41],"proced":44,"process":[19,30,37,41,43,47],"processed":[0,2],"processing":19,"processus":[39,43],"prochain":[19,20,22,39],"product":[19,39],"productionconfig":39,"produir":[21,25,33],"produit":[21,33],"profil":[0,9,12,17,19,22,29],"progress":[18,20],"project":41,"projet":41,"properly":19,"propert":18,"propos":[19,28,33],"proposent":41,"propr":[4,17,24,35],"propri\u00e9tair":[4,19,21,23,25,33,41],"proto":[29,37],"proven":33,"provid":[0,1,2,3,4,5,6,8,9,10,11,12,14,15,16,17,18,19],"provided":[0,1,2,4,17,18,19,20],"provider":19,"proxy":[29,37],"proxy_add_x_forwarded_for":37,"proxy_pass":37,"proxy_redirect":37,"proxy_set_head":[29,37],"pr\u00e9":41,"pr\u00e9c\u00e9dent":[19,33],"pr\u00e9fer":[22,33],"pr\u00e9fix":[6,19,21],"pr\u00e9f\u00e9rent":[0,4,15,17,18,20,24,26,27,28,30,31,32,33,34,49],"pr\u00e9nom":0,"pr\u00e9requ":[19,41],"pr\u00e9sent":33,"pr\u00e9serv":41,"pr\u00e9vers":19,"pr\u00eat":[38,41],"psjeexbjz2jjnqctcpxvvf":18,"psql":[41,44],"psycopg2":48,"publi":[19,21,32,44],"public":[0,1,4,18,19,25,28,33],"publiqu":[1,19,21,28,39],"publish":19,"puis":41,"puisqu":23,"puiss":29,"puissanc":[19,33],"puissent":[19,23],"pull":44,"push":21,"pwd":39,"py":39,"pyp":[39,40],"python":[19,21,29,39,40,41,44,47],"p\u00e9riod":[15,36,45],"q":[17,43],"qrj7by6h2iyjsv8sersfgv":4,"quand":[17,18,19,20,22,33,34,36],"quant":19,"quelqu":[4,5,8,12,13,16,17,18,19,23,27,29,33],"queu":[19,37],"queued":[10,18],"queued_task":10,"qwerty287":19,"r":[44,47],"r71525":6,"r7444":6,"radio":19,"radius":18,"rafraich":33,"rafra\u00eech":[9,19,33],"raison":[0,12,21,41],"ralent":26,"randon":[15,19,22,25,33],"rapid":22,"rappel":19,"rapport":[19,21],"rapporteur":12,"raquet":[25,40],"raspberry":21,"rat":[19,36],"rayon":[18,34],"re":19,"reactivated":12,"read":[0,1,3,4,5,6,8,9,10,11,12,14,15,16,17,18,19,29],"read_status":8,"readm":19,"real":37,"reason":[0,12,17],"rebuild":19,"recalcul":[4,18,20,25],"recevoir":28,"recherch":[19,21],"recommand":[9,20,29,40,41,43],"reconstruct":41,"reconstruis":41,"recor":33,"record":[0,5,7,16,17,18,19,22,24,31],"record_typ":[0,11,16,17,18],"red":[19,20,36,37,39,40,41,43],"redirect":[9,19,29],"redirect_ur":9,"redirig":[9,29,41],"redis_url":[37,39,43],"red\u00e9marr":[23,44],"refacto":19,"refactoring":19,"refactoris":[19,21],"refresh":[4,18,19,33,44],"refresh_token":9,"refreshed":19,"refreshing":19,"regist":[0,19],"registr":[0,19],"registry":41,"regl":[23,28,33],"reject":5,"rejected":5,"rejet":[5,12,22,28,38],"rel":[39,42],"relat":17,"relev":19,"remaining":19,"remarqu":[19,21,41],"remot":19,"remote_addr":37,"remov":[19,20],"removed":0,"remplac":[18,19,39,44],"ren":19,"renam":19,"rencontr":[23,41],"rendr":21,"rendu":[23,28],"renforc":30,"renomm":[19,21],"renommag":39,"renvoi":[0,6,8,9,12,15,16,17,18,33],"reopen":41,"replac":19,"report":[12,19,23,29,37,40],"report_act":12,"report_id":[12,17],"reported_by":12,"reported_comment":12,"reported_us":12,"reported_workout":12,"repository":41,"requ":[0,29,41],"request":[0,1,2,3,4,5,9,10,12,14,15,17,18,29,37,48],"request_ur":37,"requested":0,"requiert":43,"required":0,"requiring":19,"requis":[4,40,41,44,47],"requ\u00eat":[0,1,2,3,4,5,6,8,9,10,11,12,13,14,15,16,17,18,20,29],"resend":0,"resent":0,"reset":[0,19,20],"reset_password":17,"resetting":19,"resolu":19,"resolved":12,"resolved_at":12,"resolved_by":12,"respons":19,"response_typ":[9,29],"ressourc":21,"rest":[19,21,25,28,29,44],"restart":37,"restartsec":37,"restent":23,"restreint":[28,33],"result":[6,19],"retir":23,"retour":19,"retourn":[1,11,15],"retrait":33,"return":[19,37],"return_equipment":18,"returned":14,"revis":21,"revok":9,"revoked":0,"reworked":19,"rewrit":19,"re\u00e7u":[5,8,22],"rhel7":19,"rid":19,"right":[17,19],"roehv64thcg28wcewzhrnvlusoduvw8nvnhkcml57":9,"rol":[0,1,8,10,12,17,18,19,20,41],"root":47,"rout":[19,36],"row":19,"rpm":19,"rss":[7,19,21,28],"ruff":19,"run":[19,41,44],"runn":35,"running":[0,14,19],"runtim":19,"runtimeerror":48,"russ":[19,32],"russian":19,"r\u00e9":[19,44],"r\u00e9activ":23,"r\u00e9actualis":[44,47],"r\u00e9cent":30,"r\u00e9cuper":[18,20,23,29,33,34,35,44],"r\u00e9dact":28,"r\u00e9duit":19,"r\u00e9essai":41,"r\u00e9fer":21,"r\u00e9initialis":[0,17,20,22,23,33,38],"r\u00e9part":33,"r\u00e9pertoir":[0,20,21,22,27,33,39,41,44,47],"r\u00e9pons":[0,1,2,3,4,5,6,8,9,10,11,12,14,15,16,17,18],"r\u00e9solu":23,"r\u00e9solus":12,"r\u00e9sout":41,"r\u00e9sult":[20,33],"r\u00e9tro":[19,21,44],"r\u00e9trograd":19,"r\u00e9uss":0,"r\u00e9voqu":9,"r\u00f4l":[2,3,10,12,14,15,17,20,23,41],"s0rau":19,"s256":[9,29],"sais":[30,39],"sam":[0,1,4,5,10,11,12,13,16,17,18,19],"samr1":[41,44],"san":[0,1,5,8,9,12,13,15,16,17,18,19,21,27,33,35,38,41,44],"sanction":[0,17,22],"sant":21,"sat":17,"sato":19,"sauf":[17,36],"sauvegard":[20,41,44],"sav":[1,4,12,19],"schem":[29,37,39,41],"scop":[0,1,2,3,4,5,6,8,9,10,11,12,14,15,16,17,18],"screen":19,"script":[19,39],"search":[6,19],"second":[4,18,39,43],"secret":[9,29,39],"section":19,"security":19,"see":[19,44],"seem":19,"segment":[0,16,17,18,19,22,33,44],"segment_id":[18,19],"segment_short_id":18,"segments_creation_event":0,"select":[19,41],"selected":[0,18],"selon":[0,19,20,22,25,26,27,28,33,34,37,39,40,41,44],"semain":[0,15,22,24,31],"send":19,"sender_email":[37,39],"sending":19,"sensibl":21,"sent":17,"ser":[0,4,18,19,20,21,22,23,25,28,33,38,39,41,42],"serv":[0,1,2,3,4,5,6,8,12,14,16,17,18,19,36,37,39,40,41,44],"server_nam":37,"serveur":[18,19,21,23,27,28,33,35,37,38,39,40,41,44,47],"servic":[19,22,33,37,39,41,45],"session":[29,41],"set":[19,20,37,41],"setting":[19,37],"seuil":[0,22],"seul":[0,1,4,9,15,17,18,19,21,22,23,25,28,29,33,34,38,40,41,44,45],"sh":46,"shel":41,"sho":[3,4],"should":19,"show":[19,20,36],"shown":19,"shura0":19,"si":[0,1,4,5,8,9,12,13,14,15,16,17,18,19,20,21,22,23,26,27,28,29,30,31,33,34,36,37,38,39,40,41,42,43,44,47],"sien":17,"signal":[7,17,19,23,28,29,33],"signatur":[0,1,2,3,4,5,6,8,9,10,11,12,14,15,16,17,18],"sikm":19,"simontb":19,"simpl":[37,40],"simplifi":[19,32],"simplified":[19,29],"simplify":19,"sinon":[19,33,39],"sit":[9,29],"siz":[0,2,18,19,37],"ski":[25,33],"skis":[3,25],"skylan0916":19,"slacklin":19,"slothj":19,"slovenian":19,"slow":19,"small":19,"smtp":[19,38,40,47],"snowsho":[3,19],"social":19,"solut":[21,41,44,47],"som":19,"sombr":[0,22],"sorry":0,"sort":[19,29,39],"sorting":18,"soum":36,"sourc":[0,18,19,21,33,39,40],"sous":[18,39,41,42],"souscript":20,"spanish":19,"spatial":40,"special":19,"specific":[19,36],"specify":19,"speed":[0,18,19],"spinn":19,"split_workout_chart":0,"spm":19,"sport":[0,2,4,7,11,15,18,19,20,21,24,25,26,34,40],"sport_id":[0,4,11,14,15,16,17,18],"sport_label":[0,4],"sportiv":[21,27,35],"sports_list":[0,5,17],"sp\u00e9cial":38,"sp\u00e9cifi":28,"sql":41,"sqlalchemy":[19,39,40,47],"src":[21,41,47],"srtm":19,"ssl":[37,38],"ssl_certificat":37,"ssl_certificate_key":37,"stabl":19,"stack":41,"stand":[25,33],"standard":[19,42],"standarderror":37,"standardiz":19,"standardoutput":37,"standup":19,"start":[19,41],"start_elevation_at_zero":0,"started":48,"startlimitintervalsec":37,"starttl":38,"stat":[9,15,19,29],"static":[19,39,40,47],"staticmap":[19,48],"staticmap3":48,"staticmap_cach":[39,41,47],"staticmap_cache_d":[19,37,39,47],"staticmap_subdomain":[19,37,39,42],"statiqu":[27,39,42],"statist":[2,7,18,23,24,27,34],"statistic":[0,2,15,18,19],"stats_workouts_lim":2,"status":[0,1,2,3,4,5,6,8,9,10,11,12,14,15,16,17,18,19,25],"statut":[4,17,20],"stephan":19,"sticky":19,"stock":[27,29,33,35,41,44],"stop":[19,41,44],"stopp":44,"stopped":19,"stopped_speed_threshold":[0,14],"stor":19,"storag":19,"stored":19,"strateg":[22,33,36,49],"strav":46,"street":[27,35],"strength":19,"string":[0,1,2,4,5,6,8,9,10,12,13,14,15,17,18,19],"styl":[19,28],"subdomain":19,"suburb":6,"succes":[0,3,4,5,9,14,15,17,18,21],"success":[0,1,2,3,4,5,6,8,9,10,11,12,13,14,15,16,17,18],"successful":0,"successfully":0,"such":19,"suffisent":21,"suit":19,"suiv":[0,7,11,17,19,21,23,24,25,29,32,33,39,41,43,44,45,46,47],"suivent":[19,21,44],"suivr":[17,19,28,35],"sun":[0,1,10,11,12,16,17,18],"sunday":18,"super_us":[41,44],"supplied":4,"suppl\u00e9mentair":[23,40,41,44],"support":[9,13,19,21,29,33,40,45,47],"supported":19,"suppress":[4,19,20,36,39,45],"supprim":[0,1,4,9,17,18,19,20,22,23,25,28,33,39,44,45,49],"surcharg":19,"survient":47,"suspended":[0,1,2,3,4,5,6,8,9,11,12,14,15,16,17,18],"suspended_at":[0,1,8,10,12,17,18],"suspendr":23,"suspendu":[0,3,4,9,13,14,17,23,28],"suspendus":[17,28],"suspens":[0,1,17,18,23,28,38],"swimming":19,"swimrun":[19,33],"switch":19,"synchron":[2,18,23],"synchronis":[21,46],"synchronously":2,"syntax":[19,23,28,33],"system":[13,22,28,33,37,40,41,44],"systemd":[37,41],"s\u00e9anc":[0,1,2,4,7,12,13,14,15,17,19,21,22,23,24,25,26,27,28,29,31,35,39,43,46,48],"s\u00e9cur":[21,29,30],"s\u00e9curis":[37,40],"s\u00e9lection":[0,25,31,34],"s\u00e9mant":[19,21,44],"s\u00e9par":[18,29,33,36,37,43],"t2zeeuxvuy3pla8meeufyk":1,"tabl":19,"tableau":[22,23,27,30],"tag":[19,33],"tahit":0,"taill":[0,2,23,33,37],"taken":[0,19],"tant":4,"tar":[41,44],"taraw":0,"target":[37,39,42],"task":[10,18,19,37,41,43,47],"task_id":18,"task_short_id":18,"task_typ":10,"tasks_time_lim":[19,37,39,43],"tchequ":[19,32],"tcx":[18,19,20,33],"tel":[21,36,40,41,44],"temp":[15,20],"templat":19,"temporair":39,"temporary":19,"ten":[19,25,33],"term":19,"termin":[18,22],"test":[19,21,41],"testeur":19,"text":[0,1,12,17,18,20,28],"text_html":1,"text_visibility":1,"textar":19,"than":[2,17,18,19],"thank":19,"that":[0,4,19],"the":[0,1,3,4,8,14,16,17,18,19,20,23,36,37,38],"their":[12,19],"them":[0,19,22],"thermiqu":[33,40],"thes":19,"this":[18,20,23,36,37],"thovi98":19,"thread":48,"threshold":19,"thu":[5,9,17],"thunderforest":[19,42],"ticket":[21,35,41,44,49],"tient":18,"tier":[21,33,35],"tierc":[18,29],"til":[19,39,42],"tile_server_url":[37,39,42],"tim":[15,18,19],"timelin":[16,19],"timeout":[19,23,37,39,43,47],"timezon":[0,19],"titl":[16,17,18,19],"titr":[18,21,33,34],"tl":[19,38],"to":[0,2,4,15,17,18,19,20,33,37,46],"token":[0,1,2,3,4,5,6,8,9,10,11,12,14,15,16,17,18,19,20,29],"token_typ":9,"tongatapu":0,"too":[0,18],"tool":19,"tooling":19,"tooltip":19,"total":[0,4,5,8,9,10,12,15,17,18,19,22,25,31,33,34],"total_ascent":[0,15,18],"total_calor":15,"total_descent":[15,18],"total_dist":[0,4,5,15,17,18],"total_dur":[0,4,5,15,17,18],"total_moving":4,"total_workout":15,"toujour":22,"tous":[0,3,4,8,9,11,14,15,17,19,21,22,23,33,36,39,41],"tout":[4,15,18,19,20,21,22,23,25,28,33,36,39,44,47],"toutefois":21,"trac":[27,33,40],"track":[18,19,33],"traduct":[23,27],"traduit":23,"trail":[0,14,15,22,25,33],"trailing":19,"train":3,"trait":[0,2,20,22,23,33,40,44],"transactional":19,"translat":[19,21],"translated":19,"transport":[14,19,25,33],"traxy":19,"trekking":[19,25,33],"tri":[5,8,12,17,18,20,34],"trk":33,"trkseg":33,"tronqu":18,"trop":[23,33,39,41],"troubl":19,"trouv":[3,4,9,14,18,19,44],"trouvent":21,"tru":[0,1,2,3,4,8,9,10,12,13,14,17,18,19,28,38,39,41,44],"try":[0,1,3,4,8,14,16,17,18],"ts":40,"tuil":[18,19,27,33,39,40],"turc":[19,32],"turkish":19,"typ":[0,1,2,4,5,6,7,8,9,10,11,12,14,15,16,17,18,19,21,22,25,33,37,41,48],"typescript":40,"typo":19,"typos":19,"tz":20,"t\u00e2ch":[7,18,19,20,22,33,37,39,40,44,47],"t\u00e9l\u00e9charg":[0,18,19,20,23,33,38,41,44,48],"t\u00e9l\u00e9vers":[19,20,33,39,44],"t\u00eat":[0,1,2,3,4,5,6,8,9,11,12,14,15,16,17,18,29],"u":[41,44],"uberspac":41,"ubuntu":41,"ui":[19,41],"ui_url":[37,39,41],"unabl":19,"unargent":19,"unauthenticated":19,"unauthorized":[0,1,2,3,4,5,6,8,9,10,11,12,14,15,16,17,18],"unblock":17,"uncommenting":37,"undefinedobject":48,"underscor":0,"undo":[1,17,18],"unfollow":17,"uniqu":[0,1,9,15,17,18,19,20,23,29,33,39,40,44],"unit":[0,13,19,28,37,41],"unitair":[21,23],"unlik":19,"unlogged":19,"unnecessary":19,"unread":8,"unresolved":12,"unsupported":18,"unwanted":19,"up":[19,25,33,35,41,44],"updat":[0,4,18,19,21,41],"updated":[0,4,19],"updated_at":[0,12,17],"updating":2,"upgrad":[19,21,41,44],"upload":[18,19,37,39,41,46,47],"upload_d":47,"upload_fold":[37,39,47],"uploaded":[2,19,37],"uploading":19,"uploads_dir_siz":15,"uri":[19,39],"url":[0,9,19,20,28,29,33,38,39,41,47],"urtzai":19,"usag":[20,36],"use":19,"use_dark_mod":0,"use_raw_gpx_speed":0,"used":19,"user":[0,1,2,4,5,10,11,12,13,15,16,17,18,19,28,29,37,41,47],"user_data_export":10,"user_id":[0,4],"user_nam":[5,13,15,17],"user_suspens":[0,12],"user_unsuspens":12,"user_warning":12,"usernam":[0,1,5,8,10,12,17,18,19,20,28,38,41],"using":19,"usr":[41,47],"utcnow":19,"util":[19,23],"utilis":[0,1,2,3,4,5,6,7,8,9,11,12,13,14,15,16,18,19,21,22,24,25,26,27,29,30,31,32,33,34,37,38,39,41,42,43,47,48],"utility":36,"uuid":[18,19],"v":[20,41,44],"v0":[19,33,47],"v1":[19,33,41,44],"v2":40,"v3":35,"valeur":[0,4,9,13,18,19,20,22,23,29,31,33,34,36,37,38,39,42,43,47,49],"valhall":[0,2,18,19,22,39],"valhalla_api_url":[19,39],"valid":[0,1,2,3,4,5,6,8,9,10,11,12,14,15,16,17,18,19,26,38,41,47],"validat":19,"valu":[0,11,12,16,17,18,19],"variabl":[19,23,36,38,40,41,42,43,44,45,47],"various":19,"vent":33,"venv":37,"ver":[9,19,21,23,29,38,39,40,47],"verbeux":20,"verbos":20,"verrouill":23,"version":[0,2,20,21,22,23,24,25,26,28,29,30,31,32,33,34,36,38,39,40,41,42,43,45,47],"vertical":19,"vertux":19,"veuill":[19,21,28,33,37,40,41],"vi":[17,19,21,23,28],"vid":[18,19,20,21,38,39],"view":[19,36],"vill":6,"virgul":[18,36],"virtual":19,"virtualenv":[19,41],"virtuel":[25,33,39,41,43,44],"visibil":[0,1,4,18,19,22,23,25,27,28,34],"visibility":[4,18,19],"visibl":[1,16,23,24,25,27,28,33],"visual":[33,45],"visualcrossing":[19,45],"visualis":[19,28,33],"vite_app_api_url":39,"vitess":[0,11,18,19,22,31,34,40,48],"viv":[25,33],"voic":44,"voil":[25,33],"voir":[4,19,21,22,23,25,28,29,33,39,41,44,47],"volum":[39,41,47],"volumin":[23,33,47],"von":[19,33],"voodoopt":19,"votr":[21,35,37,40,41,44],"vscod":40,"vtt":[18,19,25,33],"vu":[19,21,41],"vue3":40,"vue_app_api_url":39,"vuex":40,"v\u00e9lo":[19,25],"v\u00e9rif":[9,19,21,29,41,47],"v\u00e9rifi":[14,21,42,47],"wak":0,"walking":[0,14],"wall":0,"want":37,"wantedby":37,"warning_about_large_number_of_workouts_on_map":0,"was":[0,4],"wat":19,"weath":[19,20,33],"weather_ap":39,"weather_api_key":[37,39,45],"weather_api_provid":[19,39,45],"weather_end":[16,17,18],"weather_provid":2,"weather_start":[16,17,18],"web":[0,9,21,29,35,37,39,41],"weblat":[19,21,32],"websit":9,"wed":[0,8,12,17,18],"week":[15,19],"weekend":19,"weekm":[0,15],"wget":[41,44],"when":[2,6,18,19],"which":[20,23],"whit":19,"whitewat":19,"who":19,"wik":41,"wiktor":19,"will":[0,19,20],"wind":19,"window":41,"windsurfing":19,"with":[0,4,18,19,20,33,36,41],"with_analys":18,"with_fil":[16,17,18],"with_following":17,"with_hidden_user":17,"with_inact":17,"with_statistic":18,"with_suspended":17,"without":[4,18,19],"wjgtwtqfpnprhyak5ex9pw":1,"work":[19,23,41,43,47],"worker":[19,20,23,37,38,39,41,43,44,47],"workers_process":[39,41,43],"workflow":[19,21],"workingdirectory":37,"workout":[0,1,2,4,9,11,12,13,14,15,16,17,18,19,28,29,44],"workout_comment":0,"workout_dat":[0,11,16,17,18],"workout_id":[0,1,11,12,16,17,18],"workout_lik":0,"workout_segment":19,"workout_short_id":[1,18],"workout_suspens":[12,17],"workout_unsuspens":12,"workout_visibility":[17,18],"workouts_archive_upload":[10,18],"workouts_count":[4,17],"workouts_visibility":[0,17],"writ":[0,1,2,3,4,5,8,9,12,14,17,18,29],"www":[2,39,42],"x":[0,18,19,29,37,39,40,42,47],"xmgz":19,"xml":18,"xxxx":42,"xzf":[41,44],"xzylvgwducxmqyzxzhquqt":18,"yaml":19,"yarikoptic":19,"yarn":40,"yay":44,"year":15,"yml":[19,41,44,47],"you":[0,1,2,3,4,5,6,8,9,10,11,12,14,15,16,17,18,37],"your":[0,1,2,3,4,5,6,8,9,11,12,14,15,16,17,18],"yunohost":40,"yyyy":0,"z":[18,39,42],"z2ze5qzrnmvmndejpphask":12,"zero":[18,19],"zh":19,"zip":[0,2,18,19,22,23,33],"zon":19,"zoom":[18,19],"zxcvbn":40,"z\u00e9ro":[0,22],"\u00c0":[19,33,37],"\u00e9chang":29,"\u00e9chapp":[18,19],"\u00e9chec":48,"\u00e9ch\u00e9":21,"\u00e9cran":[19,28,33],"\u00e9cras":44,"\u00e9crit":21,"\u00e9critur":[29,41,47],"\u00e9dit":[22,33],"\u00e9gal":[17,19,20,21,22,23,28,33,34,35,39,40,41,43],"\u00e9lectr":[25,33],"\u00e9lectron":[0,2,17,20,22,23,30,38,39],"\u00e9lev":[11,23,33,40],"\u00e9mettr":9,"\u00e9miss":9,"\u00e9quip":[0,7,18,19,22,27,28,29,33,34],"\u00e9tap":[41,44],"\u00e9tat":[0,1,2,3,4,5,6,8,9,10,11,12,13,14,15,16,17,18,32,33],"\u00e9valu":19,"\u00e9ven":[0,22,28,33],"\u00e9ventuel":[4,44],"\u00e9vit":[9,19,21,31,33,34,39,41,43],"\u00eate":41,"\u00eatre":[0,4,9,17,18,19,20,21,22,23,24,25,26,27,28,29,31,32,33,34,35,36,37,38,39,40,41,42,43,44,47,49],"\u00eele":6,"\u0153uvr":[21,29]},"titles":["Authentification et compte","Commentaires","Configuration","Types d'\u00e9quipement","\u00c9quipements","Demandes de suivi","Geocoding","Documentation de l'API","Notifications","OAuth2","T\u00e2ches en attente","Records","Signalements","Flux RSS","Sports","Statistiques","Flux de s\u00e9ances","Utilisateurs","S\u00e9ances","Historique des modifications","Interface de ligne de commande","Contribuer","Compte et pr\u00e9f\u00e9rences","Administration","Tableau de bord","\u00c9quipements","Carte Globale","Fonctionnalit\u00e9s","Interactions","OAuth 2.0","Inscription et authentification","Statistiques","Traductions","S\u00e9ance","Liste des s\u00e9ances","FitTrackee","Limitation d'acc\u00e8s \u00e0 l'API","D\u00e9ploiement","Courriels","